index,filename,base_tag,head_tag,base_tag_lines_txt,head_tag_lines_txt,edit_classification_truth,new_ct,obsolete_ct,reusable_ct,affected_cts,total_ct,edit_classification,decision_rationale,elapsed_time_ms
31,src/RF012 - Ajuda.claret,exp01_gti-competencias_v0.1,exp01_gti-competencias_v1.0,,"+systemName ""GTI-Competencias""	+	+usecase ""RF012 - Ajuda"" {	+  version ""1.0"" type ""Criacao"" user ""Aislan Fernandes"" date ""20/07/2020""	+  actor lider ""Lider de Pessoas""	+  actor usuarioNA ""Usuario Nao-Autenticado""	+  preCondition ""Lider de Pessoas esta autenticado no sistema""	+	+  basic {	+    step 1 lider ""acessa a funcionalidade de gestao de Perfis de Competencias a partir do menu inicial"" af[1,2,3,4]	+    step 2 system ""exibe a listagem dos Perfis de Competencias cadastrados com opcoes de 'Novo', 'Editar', 'Excluir' e 'Ajuda'"" 	+    step 3 lider ""clica na opcao 'Ajuda' para visualizar a ajuda da gestao de Perfis de Competencias""	+    step 4 system ""apresenta um painel lateral com a ajuda contextual, dividido em quatro partes: 	+				   'Glossario', 'Funcionalidades', 'Validacoes' e 'Permissoes do Usuario'"" 	+  }	+  	+  alternative 1 ""Ajuda contextual na gestao de Periodos Avaliativos"" {	+  	step 1 lider ""acessa a funcionalidade de gestao de Periodos Avaliativos a partir do menu inicial""	+    step 2 system ""exibe a listagem dos Periodos Avaliativos cadastrados com opcoes de 'Novo', 'Editar', 'Excluir' e 'Ajuda'"" 	+    step 3 lider ""clica na opcao 'Ajuda' para visualizar a ajuda da gestao de Periodos Avaliativos"" bs 4	+  }	+  	+  alternative 2 ""Ajuda contextual na gestao de Competencias (portfolio)"" {	+  	step 1 lider ""acessa a funcionalidade de gestao de Competencias (portfolio) a partir do menu inicial""	+    step 2 system ""exibe a listagem das Competencias (portfolio) cadastradas com opcoes de 'Novo', 'Editar', 'Excluir' e 'Ajuda'"" 	+    step 3 lider ""clica na opcao 'Ajuda' para visualizar a ajuda da gestao de Competencias (portfolio)"" bs 4	+  }	+  	+  alternative 3 ""Ajuda contextual na gestao de Avaliacoes"" {	+  	step 1 lider ""acessa a funcionalidade de gestao de Avaliacoes a partir do menu inicial""	+    step 2 system ""exibe a listagem das Avaliacoes cadastradas com opcoes de 'Novo', 'Editar', 'Excluir' e 'Ajuda'"" 	+    step 3 lider ""clica na opcao 'Ajuda' para visualizar a ajuda da gestao de Avaliacoes"" bs 4	+  }	+  	+  alternative 4 ""Ajuda contextual na gestao de Niveis das Competencias"" {	+  	step 1 lider ""acessa a funcionalidade de gestao de Niveis das Competencias a partir do menu inicial""	+    step 2 system ""exibe a listagem dos Niveis das Competencias cadastradas com opcoes de 'Novo', 'Editar', 'Excluir' e 'Ajuda'"" 	+    step 3 lider ""clica na opcao 'Ajuda' para visualizar a ajuda da gestao de Niveis das Competencias"" bs 4	+  }	+ 	+  postCondition ""A Ajuda e apresentada com sucesso.""	+}	",HIGH,5,0,0,"{'TC2', 'TC3', 'TC4', 'TC1', 'TC5'}",5,HIGH,"The updated snippet introduces new alternatives, which change the system behavior and add new requirements.",107682
32,src/RF013 - Gerenciar Niveis das Competencias.claret,exp01_gti-competencias_v0.1,exp01_gti-competencias_v1.0,,"+systemName ""GTI-Competencias""	+	+usecase ""RF013 - Gerenciar Niveis das Competencias"" {	+  version ""1.0"" type ""Criacao"" user ""Aislan Fernandes"" date ""11/08/2020""	+  actor lider ""Lider de Pessoas""	+  actor usuarioNA ""Usuario Nao-Autenticado""	+  preCondition ""Lider de Pessoas esta autenticado no sistema e 	+				tem permissao para gerenciar Niveis das Competencias.""	+	+  basic {	+    step 1 lider ""acessa a funcionalidade de gestao de Niveis das Competencias a partir do menu inicial"" af[4]	+    step 2 system ""exibe a listagem dos Niveis das Competencias cadastrados com opcoes de 'Novo', 'Editar', 'Excluir' e 'Ajuda'"" 	+    step 3 lider ""clica na opcao 'Novo' para criar um novo Niveis das Competencias"" af[1,2,3]	+    step 4 system ""apresenta o formulario para cadastro e alteracao de Niveis das Competencias""	+    step 5 lider ""preenche o campo 'Nome' com dados validos""	+    step 6 system ""apresenta o campo 'Nome' preenchido corretamente""	+    step 7 lider ""preenche o campo 'Valor' com um numero inteiro referente a pontuacao a ser obtida no atendimento do respectivo nivel""	+    step 8 system ""apresenta o campo 'Valor' preenchido corretamente""	+    step 9 lider ""preenche o campo 'Descricao' com a descricao do nivel de competencia""	+    step 10 system ""apresenta o campo 'Descricao' preenchido corretamente""	+	step 11 lider ""clica na opcao 'Salvar'""	+    step 12 system ""realiza a acao conforme a opcao selecionada pelo usuario e 	+				   retorna feedback correspondente"" ef[1,2]	+  }	+	+  alternative 1 ""Editar Nivel das Competencias Existente"" {	+    step 1 lider ""seleciona um Nivel das Competencias da listagem""	+    step 2 system ""destaca o Nivel das Competencias selecionado na listagem""	+    step 3 lider ""clica na opcao 'Editar' para modificar o Nivel das Competencias selecionado"" bs 4	+  }	+  	+  alternative 2 ""Confirmar Exclusao do Nivel das Competencias"" {	+  	step 1 lider ""seleciona um Nivel das Competencias da listagem""	+    step 2 system ""destaca o Nivel das Competencias selecionado na listagem""	+    step 3 lider ""clica na opcao 'Excluir' para excluir o Nivel das Competencias selecionado""	+    step 4 system ""solicita confirmacao de exclusao""	+    step 5 lider ""confirma a exclusao do Nivel das Competencias""	+    step 6 system ""exibe a listagem dos Niveis das Competencias sem o Nivel das Competencias excluido"" ef[3]	+  }	+	+  alternative 3 ""Negar Exclusao do Nivel das Competencias"" {	+  	step 1 lider ""seleciona um Nivel das Competencias da listagem""	+    step 2 system ""destaca o Nivel das Competencias selecionado na listagem""	+    step 3 lider ""clica na opcao 'Excluir' para excluir o Nivel das Competencias selecionado""	+    step 4 system ""solicita confirmacao de exclusao""	+    step 5 lider ""nao confirma a exclusao do Nivel das Competencias""	+    step 6 system ""exibe a listagem dos Niveis das Competencias com o Nivel das Competencias excluido""	+  }	+  	+  alternative 4 ""Modo de visualizacao para usuarios nao-autenticados"" {	+  	step 1 usuarioNA ""acessa a funcionalidade de gestao de Niveis das Competencias a partir do menu inicial""	+  	step 2 system ""exibe a listagem dos Niveis das Competencias cadastrados apenas para visualizacao com a opcao 'Ajuda'""	+  }	+	+  exception 1 ""Falha ao Salvar o Novo Nivel das Competencias"" {	+    step 1 system ""exibe uma mensagem de erro ao tentar salvar o novo Nivel das Competencias, informando o campo ou a validacao que falhou""	+  }	+	+  exception 2 ""Erro ao Editar Nivel das Competencias"" {	+    step 1 system ""exibe uma mensagem de erro ao tentar editar o Nivel das Competencias, informando o campo ou a validacao que falhou""	+  }	+	+  exception 3 ""Falha na Exclusao do Nivel das Competencias"" {	+    step 1 system ""exibe uma mensagem de erro ao tentar excluir o Nivel das Competencias""	+  }	+	+  postCondition ""A gestao de Niveis das Competencias e realizada com sucesso.""	+}	",HIGH,2,0,8,"{'TC10', 'TC7'}",10,LOW,"The changes made are mainly related to textual updates, such as renaming actors and steps, and adding or modifying metadata. There are no semantic edits that would change the system behavior.",146087
33,src/RF005 - Visualizar Status do Processo.claret,exp01_gti-competencias_v1.0,exp01_gti-competencias_v1.1,,"+systemName ""GTI-Competencias""	+	+usecase ""RF005 - Visualizar Status do Processo"" {	+  version ""1.1"" type ""Criacao"" user ""Aislan Fernandes"" date ""08/10/2020""	+  actor usuarioNA ""Usuario Nao-Autenticado""	+  preCondition ""Usuario nao-autenticado no sistema se encontra na tela inicial do sistema""  	+  basic {	+    step 1 usuarioNA ""acessa a funcionalidade para visualizar o status do PGDC""	+    step 2 system ""apresenta o campo 'Periodo Avaliativo' para ser escolhido pelo usuario"" ef[1]	+    step 3 usuarioNA ""escolhe no campo 'Periodo Avaliativo' o ano correspondente""	+    step 4 system ""exibe na pagina uma tabela contendo as informacoes (basicamente listagem dos perfis de competencias - cf. RF006): 	+                   Perfil de Competencias; Unidade de Trabalho; Gerente do Desempenho; e, Situacao.""	+  }	+  exception 1 ""Nao existem Periodos Avaliativos Cadastrados"" {	+  	step 1 system ""exibe uma mensagem de erro informando que nao existem Periodos Avaliativos cadastrados""	+  }	+  postCondition ""Usuario visualiza a tabela das Permissoes concedidas ao seu usuario""	+}	",HIGH,1,0,1,{'TC2'},2,HIGH,"The updated snippet adds a new actor, changes the system behavior by introducing an exception flow, and modifies pre-conditions. These changes significantly impact the use case's semantics.",197232
34,src/RF008 - Gerenciar Respostas de Avaliacoes.claret,exp01_gti-competencias_v1.0,exp01_gti-competencias_v1.1,,"+systemName ""GTI-Competencias""	+	+usecase ""RF008 - Gerenciar Respostas de Avaliacoes"" {	+  version ""1.1"" type ""Criacao"" user ""Aislan Fernandes"" date ""03/12/2020""	+  actor avaliador ""Avaliador de Pessoas""	+  preCondition ""Avaliador de Pessoas esta autenticado no sistema; e, tem permissao para gerenciar Respostas de Avaliacoes""	+	+  basic {	+    step 1 avaliador ""acessa a funcionalidade de Avaliacoes a partir do menu inicial""	+    step 2 system ""exibe a listagem das Avaliacoes cadastradas com a opcao 'Formulario' dentre as varias listadas"" 	+    step 3 avaliador ""com uma avaliacao selecionada, clica na opcao 'Formulario' para criar uma nova Avaliacao""	+    step 4 system ""apresenta o formulario para cadastro e alteracao de Respostas de Avaliacao"" ef[1]	+    step 5 avaliador  ""seleciona o 'Nivel da Competencia' da Avaliacao (1 a 4) para cada Perfil de Competencias avaliado""	+    step 6 system ""apresenta o campo 'Nivel da Competencia' preenchido corretamente""	+    step 7 avaliador ""adiciona 'Apontamentos' sobre a avaliacao para cada Perfil de Competencias avaliado""	+    step 8 system ""apresenta os 'Apontamentos' preenchidos corretamente""	+	step 9 avaliador ""clica na opcao 'Salvar'"" af[1]	+    step 10 system ""realiza a acao conforme a opcao selecionada pelo usuario e 	+				   retorna feedback correspondente"" ef[2,3]	+  }	+	+  exception 1 ""Nao e um dos avaliadores"" {	+    step 1 system ""exibe uma mensagem de erro informando ao usuario que nao e um dos avaliadores""	+  }	+  	+  exception 2 ""Falha ao Salvar a nova Avaliacao"" {	+    step 1 system ""exibe uma mensagem de erro ao tentar salvar, informando o campo ou a validacao que falhou""	+  }	+	+  exception 3 ""Erro ao Editar Avaliacao"" {	+    step 1 system ""exibe uma mensagem de erro ao tentar editar, informando o campo ou a validacao que falhou""	+  }	+  	+  alternative 1 ""Resolve 'limpar' a Resposta de Avaliacao"" {	+    step 1 avaliador ""clica na opcao 'Excluir' para cada Perfil de Competencias avaliado""	+    step 2 system ""limpa os campos apresentados 'Nivel da Competencia' e 'Apontamentos' apresentados na tela para cada Perfil de Competencias avaliado""	+    step 5 avaliador ""verifica que os campos 'Nivel da Competencia' e 'Apontamentos' estao limpos"" bs 5 	+  }	+	+  postCondition ""A gestao de Respostas de Avaliacoes e realizada com sucesso.""	+}	",HIGH,2,0,5,"{'TC4', 'TC7'}",7,LOW,"The changes are mainly syntactic, with the addition of a system name and use case title, as well as some formatting adjustments. There are no semantic changes to the expected behavior of the system or the requirements specified.",125376
35,src/RF009 - Gerenciar Resultados de Avaliacoes.claret,exp01_gti-competencias_v1.0,exp01_gti-competencias_v1.1,,"+systemName ""GTI-Competencias""	+	+usecase ""RF009 - Gerenciar Resultados de Avaliacoes"" {	+  version ""1.1"" type ""Criacao"" user ""Aislan Fernandes"" date ""30/11/2020""	+  actor lider ""Lider de Pessoas""	+  preCondition ""Lider de Pessoas esta autenticado no sistema; e, tem permissao para gerenciar Resultados de Avaliacoes""	+	+  basic {	+    step 1 lider ""acessa a funcionalidade de Avaliacoes a partir do menu inicial""	+    step 2 system ""exibe a listagem das Avaliacoes cadastradas com a opcao 'Resultado' dentre as varias listadas"" 	+    step 3 lider ""com uma avaliacao selecionada, clica na opcao 'Resultados' para efetivar o feedback""	+    step 4 system ""apresenta o formulario para cadastro da Ata de Reuniao""	+    step 5 lider  ""seleciona o 'Ata de Reuniao de Feedback' da Avaliacao (1 a 4) para cada Perfil de Competencias avaliado""	+    step 6 system ""apresenta o campo 'Ata de Reuniao de Feedback' preenchido corretamente""	+	step 7 lider ""clica na opcao 'Salvar'"" af[1]	+    step 8 system ""realiza a acao conforme a opcao selecionada pelo usuario e 	+				   retorna feedback correspondente"" ef[1,2]	+  }	+	+  exception 1 ""Falha ao Salvar a nova Avaliacao"" {	+    step 1 system ""exibe uma mensagem de erro ao tentar salvar, informando o campo ou a validacao que falhou""	+  }	+	+  exception 2 ""Erro ao Editar Avaliacao"" {	+    step 1 system ""exibe uma mensagem de erro ao tentar editar, informando o campo ou a validacao que falhou""	+  }	+  	+  alternative 1 ""Encerrar definitivamente"" {	+    step 1 lider ""clica na opcao 'Encerrar' para a Avaliacao de Competencias""	+    step 2 system ""apresenta o campo 'Ata de Reuniao de Feedback'""	+  }	+	+  postCondition ""A gestao de Resultados de Avaliacoes e realizada com sucesso.""	+}	",HIGH,1,0,3,{'TC4'},4,LOW,"The changes in the updated snippet are mostly textual updates, with detailing and formatting adjustments. There is no change in the system expected behavior or introduction of new requirements or exceptions.",121227
36,src/RF011 - Gerenciar Competencias Portfolio.claret,exp01_gti-competencias_v1.0,exp01_gti-competencias_v1.1,"-    step 2 system ""exibe a listagem dos Competencias (Portfolio) cadastrados com opcoes de 'Novo', 'Editar', 'Excluir' e 'Ajuda'"" 	","+    step 2 system ""exibe a listagem das Competencias (Portfolio) cadastradas com opcoes de 'Novo', 'Editar', 'Excluir' e 'Ajuda'"" 	",LOW,0,27,1,"{'TC3', 'TC9', 'TC24', 'TC26', 'TC22', 'TC5', 'TC14', 'TC8', 'TC10', 'TC18', 'TC28', 'TC12', 'TC2', 'TC13', 'TC7', 'TC20', 'TC4', 'TC6', 'TC23', 'TC16', 'TC21', 'TC17', 'TC25', 'TC11', 'TC27', 'TC15', 'TC19'}",28,LOW,"The updated snippet only changes the wording from 'cadastrados' to 'cadastradas', which is a minor change in text and does not affect the overall system behavior or requirements.",107533
37,src/RF011 - Gerenciar Competencias Portfolio.claret,exp01_gti-competencias_v1.0,exp01_gti-competencias_v1.1,"-    step 2 system ""destaca o Competencias (Portfolio) selecionado na listagem""	-    step 3 lider ""clica na opcao 'Editar' para modificar o Competencias (Portfolio) selecionado"" bs 4	","+    step 2 system ""destaca a Competencia (Portfolio) selecionada na listagem""	+    step 3 lider ""clica na opcao 'Editar' para modificar a Competencia (Portfolio) selecionada"" bs 4	",LOW,0,12,16,"{'TC11', 'TC9', 'TC7', 'TC13', 'TC6', 'TC10', 'TC16', 'TC15', 'TC5', 'TC14', 'TC12', 'TC8'}",28,LOW,The changes are only textual updates and do not alter the system behavior. The semantic meaning of the use case remains the same.,83867
38,src/RF011 - Gerenciar Competencias Portfolio.claret,exp01_gti-competencias_v1.0,exp01_gti-competencias_v1.1,"-    step 2 system ""destaca o Competencias (Portfolio) selecionado na listagem""	-    step 3 lider ""clica na opcao 'Excluir' para excluir o Competencias (Portfolio) selecionado""	","+    step 2 system ""destaca a Competencia (Portfolio) selecionada na listagem""	+    step 3 lider ""clica na opcao 'Excluir' para excluir a Competencia (Portfolio) selecionada""	",LOW,0,3,25,"{'TC2', 'TC3', 'TC4'}",28,LOW,"The changes in the updated snippet are mainly related to reordering and renaming of some steps (e.g., 'destaca o Competencias' to 'destaca a Competencia', 'selecionado na listagem' to 'selecionada na listagem') and do not change the system behavior or introduce new requirements.",96750
39,src/RF011 - Gerenciar Competencias Portfolio.claret,exp01_gti-competencias_v1.0,exp01_gti-competencias_v1.1,"-    step 6 system ""exibe a listagem dos Competencias (Portfolio) sem o Competencias (Portfolio) excluido"" ef[3]	","+    step 6 system ""exibe a listagem das Competencias (Portfolio) sem a Competencia (Portfolio) excluida"" ef[3]	",LOW,0,1,27,{'TC3'},28,LOW,"The change is a minor typo in the text, where 'a' was added and 'o' was removed. The system behavior remains unchanged.",91773
40,src/RF011 - Gerenciar Competencias Portfolio.claret,exp01_gti-competencias_v1.0,exp01_gti-competencias_v1.1,"-    step 2 system ""destaca o Competencias (Portfolio) selecionado na listagem""	-    step 3 lider ""clica na opcao 'Excluir' para excluir o Competencias (Portfolio) selecionado""	","+    step 2 system ""destaca a Competencia (Portfolio) selecionada na listagem""	+    step 3 lider ""clica na opcao 'Excluir' para excluir a Competencia (Portfolio) selecionada""	",LOW,0,3,25,"{'TC2', 'TC3', 'TC4'}",28,LOW,"The changes are merely textual updates, specifically changing the verb 'destaca o' to 'destaca a', and changing the noun 'Competencias (Portfolio)' to 'Competencia (Portfolio)'. These edits do not change the system behavior and simply provide more clarity in the use case description.",88783
41,src/RF011 - Gerenciar Competencias Portfolio.claret,exp01_gti-competencias_v1.0,exp01_gti-competencias_v1.1,"-    step 6 system ""exibe a listagem dos Competencias (Portfolio) com o Competencias (Portfolio) excluido""	","+    step 6 system ""exibe a listagem das Competencias (Portfolio) com a Competencia (Portfolio) excluida""	",LOW,0,1,27,{'TC2'},28,LOW,"The edit is a simple change in the wording of a step, from 'exibe a listagem dos Competencias (Portfolio) com o Competencias (Portfolio) excluido' to 'exibe a listagem das Competencias (Portfolio) com a Competencia (Portfolio) excluida'. This change does not alter the system behavior or introduce new requirements, but is more of a textual update.",96034
42,src/RF011 - Gerenciar Competencias Portfolio.claret,exp01_gti-competencias_v1.0,exp01_gti-competencias_v1.1,"-  	step 2 system ""exibe a listagem dos Competencias (Portfolio) cadastrados apenas para visualizacao com a opcao 'Ajuda'""	","+  	step 2 system ""exibe a listagem das Competencias (Portfolio) cadastradas apenas para visualizacao com a opcao 'Ajuda'""	",LOW,0,1,27,{'TC1'},28,LOW,"The original and updated snippets have the same semantics, only a minor change in wording is observed, which does not affect the system behavior.",91411
43,src/RF014 - Administrador de Dados.claret,exp01_gti-competencias_v1.0,exp01_gti-competencias_v1.1,,"+systemName ""GTI-Competencias""	+	+usecase ""RF014 - Administrador de Dados"" {	+  version ""1.1"" type ""Criacao"" user ""Aislan Fernandes"" date ""02/12/2020""	+  actor admin ""Administrador""	+  preCondition ""Administrador esta autenticado no sistema; e, tem permissao para alterar Gerente de Desempenho""	+	+  basic {	+    step 1 admin ""acessa a funcionalidade de Catalogo (Perfis) de Competencias a partir do menu inicial""	+    step 2 system ""exibe a listagem das Catalogo (Perfis) de Competencias cadastradas com a opcao 'Alterar Gerente' dentre as varias listadas"" 	+    step 3 admin ""com um perfil selecionado, clica na opcao 'Alterar Gerente' para efetivar a mudanca""	+    step 4 system ""apresenta o formulario para cadastro do novo Gerente de Desempenho""	+    step 5 admin  ""preenche o campo 'Login do Novo Gerente de Desempenho' do novo Gerente de Desempenho para o Perfil de Competencias ""	+    step 6 system ""apresenta o campo 'Login do Novo Gerente de Desempenho' preenchido corretamente""	+	step 7 admin ""clica na opcao 'Confirmar'"" af[1]	+    step 8 system ""realiza a acao conforme a opcao selecionada pelo usuario e 	+				   retorna feedback correspondente"" ef[1,2]	+  }	+	+  exception 1 ""Falha ao Salvar o novo Gerente de Desempenho"" {	+    step 1 system ""exibe uma mensagem de erro ao tentar salvar, informando o campo ou a validacao que falhou""	+  }	+  	+  alternative 1 ""Encerrar definitivamente"" {	+    step 1 admin ""clica na opcao 'Cancelar'""	+    step 2 system ""apresenta o Catalogo (Perfis) de Competencias cadastradas sem nenhuma alteracao""	+  }	+	+  postCondition ""A alteracao do Gerente de Desempenho e realizada com sucesso.""	+}	",HIGH,1,0,2,{'TC3'},3,HIGH,"The updated snippet introduces a new alternative flow (1) and exception flow (1,2), which change the system behavior. Additionally, it adds new steps in the basic flow that alter the overall functionality of the use case.",99857
44,src/RF004 - Visualizar Painel do Desempenho.claret,exp01_gti-competencias_v1.1,exp01_gti-competencias_v1.2,"-  preCondition ""Usuario nao-autenticado no sistema se encontra na tela inicial do sistema""  	","+  preCondition ""Usuario nao-autenticado no sistema""  	",LOW,0,4,0,"{'TC2', 'TC1', 'TC3', 'TC4'}",4,LOW,"The change is a textual update, changing the description to be more concise without altering the semantics or behavior of the use case.",104175
45,src/RF004 - Visualizar Painel do Desempenho.claret,exp01_gti-competencias_v1.1,exp01_gti-competencias_v1.2,"-    step 1 usuarioNA ""acessa a funcionalidade para visualizar o status do PGDC""	","+    step 1 usuarioNA ""acessa a tela inicial do sistema"" af[1]	",HIGH,0,2,2,"{'TC3', 'TC4'}",4,HIGH,"The change from the original snippet to the updated snippet introduces a new alternative flow (af) in the use case, which changes the system behavior. This is a semantic edit and not just a syntactic one.",87910
46,src/RF004 - Visualizar Painel do Desempenho.claret,exp01_gti-competencias_v1.1,exp01_gti-competencias_v1.2,"-    step 4 system ""exibe na pagina uma tabela contendo as informacoes (basicamente listagem dos perfis de competencias - cf. RF006): 	-                   Perfil de Competencias; Unidade de Trabalho; Gerente do Desempenho; e, Situacao.""	","+    step 4 system ""exibe na pagina uma tabela contendo as informacoes (basicamente listagem das unidades) do estado de realizacao do PGPD, nas fases: 	+                   Responsavel (Unidade), Competencias, Avaliacoes.""	",LOW,0,2,2,"{'TC2', 'TC4'}",4,HIGH,"The original and updated snippets change the expected behavior of the system, as it changes what information is displayed on the page.",91070
47,src/RF004 - Visualizar Painel do Desempenho.claret,exp01_gti-competencias_v1.1,exp01_gti-competencias_v1.2,,"+  	+  alternative 1 ""Retornando a tela inicial pelo menu do sistema"" {	+  	step 1 usuarioNA ""acessa a opcao 'Inicio (Painel)'"" bs 2	+  }	+  	",HIGH,2,0,2,"{'TC2', 'TC1'}",4,HIGH,"The changes introduce a new alternative flow in the use case, which likely alters the system behavior. This indicates a high-impact edit.",91537
48,src/RF009 - Gerenciar Resultados de Avaliacoes.claret,exp01_gti-competencias_v1.1,exp01_gti-competencias_v1.2,"-    step 3 lider ""com uma avaliacao selecionada, clica na opcao 'Resultados' para efetivar o feedback""	","+    step 3 lider ""com uma avaliacao selecionada, clica na opcao 'Resultado' para efetivar o feedback""	",LOW,0,4,0,"{'TC2', 'TC1', 'TC3', 'TC4'}",4,LOW,"The change is a typo correction, where 'Resultados' is changed to 'Resultado'. It does not alter the system behavior or introduce new requirements.",87731
49,src/RF009 - Gerenciar Resultados de Avaliacoes.claret,exp01_gti-competencias_v1.1,exp01_gti-competencias_v1.2,"-	step 7 lider ""clica na opcao 'Salvar'"" af[1]	-    step 8 system ""realiza a acao conforme a opcao selecionada pelo usuario e 	","+    step 7 lider ""verifica a presenca (somente leitura) do detalhe de cada competencia avaliada""	+    step 8 system ""apresenta os detalhes de cada competencia, incluindo: 	+                   - a descricao da competencia;	+                   - o valor da autoavaliacao, a media das notas dos avaliadores e o valor da meta do avaliado;	+                   - os niveis de avaliacao para aquela competencia; e,	+                   - os apontamentos.""	+	step 9 lider ""clica na opcao 'Salvar'"" af[1]	+    step 10 system ""realiza a acao conforme a opcao selecionada pelo usuario e 	",HIGH,0,3,1,"{'TC2', 'TC3', 'TC4'}",4,HIGH,"The updated snippet introduces a new step and changes the expected behavior of the system, making it a high-impact change.",89687
50,src/RF014 - Administrador de Dados.claret,exp01_gti-competencias_v1.1,exp01_gti-competencias_v1.2,"-    step 1 admin ""acessa a funcionalidade de Catalogo (Perfis) de Competencias a partir do menu inicial""	-    step 2 system ""exibe a listagem das Catalogo (Perfis) de Competencias cadastradas com a opcao 'Alterar Gerente' dentre as varias listadas"" 	","+    step 1 admin ""acessa a funcionalidade de 'Catalogo (Perfis) de Competencias' a partir do menu inicial""	+    step 2 system ""exibe a listagem do Catalogo (Perfis) de Competencias cadastradas com a opcao 'Alterar Gerente' dentre as varias listadas"" 	",LOW,0,3,0,"{'TC2', 'TC1', 'TC3'}",3,LOW,"The changes are textual updates, with no change in system behavior. The only difference is the addition of apostrophes to make it grammatically correct.",93232
