index,filename,base_tag,head_tag,base_tag_lines_txt,head_tag_lines_txt,edit_classification_truth,new_ct,obsolete_ct,reusable_ct,affected_cts,total_ct,edit_classification,decision_rationale,elapsed_time_ms
83,src/RF015 - Gerenciar Planos de Capacitacao de TI.claret,exp01_gti-competencias_v1.3,exp01_gti-competencias_v1.4,"-	step 11 lider ""preencha o campo 'Observacao' com informacoes adicionais ou relevantes sobre o plano de capacitacao""	","+	step 11 lider ""preenche o campo 'Observacao' com informacoes adicionais ou relevantes sobre o plano de capacitacao""	",LOW,0,6,5,"{'TC11', 'TC9', 'TC7', 'TC6', 'TC10', 'TC8'}",11,LOW,"The change in the snippet is a syntactic edit, which only changes the verb tense from 'preencha' to 'preenche'. This does not alter the system behavior or requirements.",83816
84,src/RF015 - Gerenciar Planos de Capacitacao de TI.claret,exp01_gti-competencias_v1.3,exp01_gti-competencias_v1.4,"-    step 1 lider ""seleciona um Planos de Capacitacao de TI da listagem""	","+    step 1 lider ""seleciona um Plano de Capacitacao de TI da listagem""	",LOW,0,7,4,"{'TC2', 'TC3', 'TC7', 'TC4', 'TC6', 'TC5', 'TC8'}",11,LOW,"The change is a textual update where the name of the actor (lider) remains unchanged and no new requirements, features or business model entities are introduced. It is merely a detailing in the notation.",83734
85,src/RF015 - Gerenciar Planos de Capacitacao de TI.claret,exp01_gti-competencias_v1.3,exp01_gti-competencias_v1.4,"-  	step 1 lider ""seleciona um Planos de Capacitacao de TI da listagem""	","+  	step 1 lider ""seleciona um Plano de Capacitacao de TI da listagem""	",LOW,0,7,4,"{'TC2', 'TC3', 'TC7', 'TC4', 'TC6', 'TC5', 'TC8'}",11,LOW,"The updated snippet only changes the formatting of the text, specifically adding a plus sign at the beginning. This does not change the system behavior or introduce new requirements or features.",85284
86,src/RF015 - Gerenciar Planos de Capacitacao de TI.claret,exp01_gti-competencias_v1.3,exp01_gti-competencias_v1.4,"-    step 6 system ""exibe a listagem das Planos de Capacitacao de TI sem a Capacitacao de TI excluida"" ef[3,4]	","+    step 6 system ""exibe a listagem dos Planos de Capacitacao de TI sem a Capacitacao de TI excluida"" ef[3,4]	",LOW,0,1,10,{'TC3'},11,LOW,"The updated snippet does not change the system behavior; it is a mere textual update, specifically changing the wording from 'Planos de Capacitacao de TI' to 'Planos de Capacitacao de TI sem a Capacitacao de TI excluida'.",91077
87,src/RF015 - Gerenciar Planos de Capacitacao de TI.claret,exp01_gti-competencias_v1.3,exp01_gti-competencias_v1.4,"-  alternative 3 ""Negar Exclusao da Capacitacao de TI"" {	-  	step 1 lider ""seleciona um Planos de Capacitacao de TI da listagem""	","+  alternative 3 ""Nao Confirmar Exclusao da Capacitacao de TI"" {	+  	step 1 lider ""seleciona um Plano de Capacitacao de TI da listagem""	",LOW,0,7,4,"{'TC2', 'TC3', 'TC7', 'TC4', 'TC6', 'TC5', 'TC8'}",11,LOW,"The change is a simple renaming of the alternative from 'Negar Exclusao da Capacitacao de TI' to 'Nao Confirmar Exclusao da Capacitacao de TI'. This does not change the system behavior, and it is only a textual update.",87345
88,src/RF015 - Gerenciar Planos de Capacitacao de TI.claret,exp01_gti-competencias_v1.3,exp01_gti-competencias_v1.4,"-    step 6 system ""exibe a listagem das Planos de Capacitacao de TI com a Capacitacao de TI excluida""	","+    step 6 system ""exibe a listagem dos Planos de Capacitacao de TI com a Capacitacao de TI nao excluida""	",LOW,0,1,10,{'TC2'},11,LOW,"The updated snippet changes the description of an existing step, but does not change its behavior or the system's expected output. The change is a simple rephrasing and is likely to have minimal impact on the overall functionality of the use case.",98638
89,src/RF015 - Gerenciar Planos de Capacitacao de TI.claret,exp01_gti-competencias_v1.3,exp01_gti-competencias_v1.4,"-  	step 2 system ""exibe a listagem das Planos de Capacitacao de TI cadastradas apenas para visualizacao com a opcao 'Ajuda'""	","+  	step 2 system ""exibe a listagem dos Planos de Capacitacao de TI cadastrados apenas para visualizacao com a opcao 'Ajuda'""	",LOW,0,1,10,{'TC1'},11,LOW,"The update does not change the system behavior or requirements, but rather clarifies the original text by using the correct verb form ('cadastradas' to 'cadastrados') and updating the preposition ('apenas para visualizacao' to 'apenas para visualizacao com a opcao').",91325
90,src/RF018 - Gerenciar Metas de Desempenho.claret,exp01_gti-competencias_v1.3,exp01_gti-competencias_v1.4,"-  preCondition ""Lider de Pessoas esta autenticado no sistema; e, tem permissao para gerenciar Metas de Desempenho""	","+  preCondition ""Lider de Pessoas esta autenticado no sistema e tem permissao para gerenciar Metas de Desempenho""	",LOW,0,2,0,"{'TC2', 'TC1'}",2,LOW,"The change is a syntactic edit, reducing redundancy in the precondition by removing the space between 'e' and 'tem', and joining 'autenticado' and 'no' into 'autenticado no'. This doesn't alter the semantics or system behavior.",83903
91,src/RF018 - Gerenciar Metas de Desempenho.claret,exp01_gti-competencias_v1.3,exp01_gti-competencias_v1.4,"-    step 3 lider ""com uma avaliacao selecionada, clica na opcao 'Editar' modificar a Avaliacao de Desempenho""	-    step 4 system ""apresenta o formulario com o campo 'Metas' constando cada Competencia do perfil avaliado""	","+    step 3 lider ""com uma avaliacao selecionada, clica na opcao 'Editar' para modificar a Avaliacao de Desempenho""	+    step 4 system ""apresenta o formulario com o campo 'Metas' contendo cada Competencia do perfil avaliado""	",LOW,0,2,0,"{'TC2', 'TC1'}",2,LOW,The changes are textual updates and do not affect the system behavior or requirements.,81864
92,src/RF008 - Gerenciar Respostas de Avaliacoes.claret,exp01_gti-competencias_v1.4,exp01_gti-competencias_v1.5,"-    step 2 system ""exibe a listagem das Avaliacoes cadastradas com a opcao 'Formulario' dentre as varias listadas"" 	-    step 3 avaliador ""com uma avaliacao selecionada, clica na opcao 'Formulario' para criar uma nova Avaliacao""	","+    step 2 system ""exibe a listagem das Avaliacoes cadastradas com a opcao 'Formulario' dentre as varias exibidas"" 	+    step 3 avaliador ""com uma avaliacao selecionada, clica na opcao 'Formulario' para responder a uma Avaliacao ou Autoavaliacao""	",LOW,0,7,0,"{'TC2', 'TC3', 'TC7', 'TC4', 'TC6', 'TC1', 'TC5'}",7,HIGH,"The updated snippet introduces a new feature ('responder a uma Avaliacao ou Autoavaliacao') which was not present in the original snippet, therefore it's a high-impact change.",101361
93,src/RF008 - Gerenciar Respostas de Avaliacoes.claret,exp01_gti-competencias_v1.4,exp01_gti-competencias_v1.5,"-    step 5 avaliador  ""seleciona o 'Nivel da Competencia' da Avaliacao (1 a 4) para cada Perfil de Competencias avaliado""	-    step 6 system ""apresenta o campo 'Nivel da Competencia' preenchido corretamente""	-    step 7 avaliador ""adiciona 'Apontamentos' sobre a avaliacao para cada Perfil de Competencias avaliado""	-    step 8 system ""apresenta os 'Apontamentos' preenchidos corretamente""	-	step 9 avaliador ""clica na opcao 'Salvar'"" af[1]	-    step 10 system ""realiza a acao conforme a opcao selecionada pelo usuario e 	-				    retorna feedback correspondente"" ef[2,3]	","+    step 5 avaliador  ""seleciona o 'Nivel de Interacao' para cada Perfil de Competencias avaliado""	+    step 6 system ""apresenta o campo 'Nivel de Interacao' preenchido corretamente""	+    step 7 avaliador  ""seleciona que e 'Capaz de Avaliar a Competencia' para cada Perfil de Competencias avaliado"" af[2]	+    step 8 system ""apresenta o campo 'Capaz de Avaliar' preenchido como 'SIM'""	+    step 9 avaliador  ""seleciona o 'Nivel da Competencia' da Avaliacao (1 a 4) para cada Perfil de Competencias avaliado""	+    step 10 system ""apresenta o campo 'Nivel da Competencia' preenchido corretamente""	+    step 11 avaliador ""adiciona 'Apontamentos' sobre a avaliacao para cada Perfil de Competencias avaliado""	+    step 12 system ""apresenta os 'Apontamentos' preenchidos corretamente""	+	step 13 avaliador ""clica na opcao 'Salvar'"" af[1]	+    step 14 system ""realiza a acao conforme a opcao selecionada pelo usuario e 	+				    retorna feedback correspondente"" ef[2,3,4]	",LOW,0,2,5,"{'TC4', 'TC7'}",7,HIGH,"The updated snippet changes the system expected behavior (semantic edit), as it adds a new step and modifies existing steps, which introduces new requirements. It also changes the alternative flow and exception flow.",103099
94,src/RF008 - Gerenciar Respostas de Avaliacoes.claret,exp01_gti-competencias_v1.4,exp01_gti-competencias_v1.5,,"+  exception 4 ""Sem Justificativa"" {	+    step 1 system ""exibe uma mensagem de erro informando ao usuario que nao informou justificativa""	+  }	+  	",HIGH,4,0,13,"{'TC16', 'TC4', 'TC12', 'TC8'}",17,HIGH,"The updated snippet adds a new exception flow (step 1 system 'exibe uma mensagem de erro informando ao usuario que nao informou justificativa'), which changes the expected behavior of the system.",115305
95,src/RF008 - Gerenciar Respostas de Avaliacoes.claret,exp01_gti-competencias_v1.4,exp01_gti-competencias_v1.5,,"+  	+  alternative 2 ""Nao e Capaz de Avaliar a Competencia"" {	+  	step 1 avaliador  ""seleciona que nao e 'Capaz de Avaliar a Competencia' para cada Perfil de Competencias avaliado""	+    step 2 system ""apresenta o campo 'Capaz de Avaliar' preenchido como 'NAO'""	+    step 3 avaliador ""preenche o campo de 'Justificativas' para cada Perfil de Competencias avaliado""	+    step 4 system ""apresenta o campo de 'Capaz de Avaliar' preenchido corretamente""	+    step 5 avaliador ""clica no botao 'Justificar'"" bs 14	+  }	",HIGH,8,0,9,"{'TC2', 'TC3', 'TC9', 'TC7', 'TC4', 'TC6', 'TC5', 'TC8'}",17,HIGH,"The updated snippet introduces a new alternative flow and modifies the system's behavior, which indicates a high-impact change.",92601
96,src/RF009 - Gerenciar Resultados de Avaliacoes.claret,exp01_gti-competencias_v1.4,exp01_gti-competencias_v1.5,"-    step 2 system ""exibe a listagem das Avaliacoes cadastradas com a opcao 'Resultado' dentre as varias listadas"" 	","+    step 2 system ""exibe a listagem das Avaliacoes cadastradas com a opcao 'Resultado' dentre as varias exibidas"" 	",LOW,0,4,0,"{'TC2', 'TC1', 'TC3', 'TC4'}",4,LOW,"The change is low-impact because it only changes the wording from 'cadastradas' to 'exibidas', which is a minor textual edit and does not alter the system behavior.",96006
97,src/RF016 - Copiar Itens de Avaliacao.claret,exp01_gti-competencias_v1.4,exp01_gti-competencias_v1.5,,"+systemName ""GTI-Competencias""	+	+usecase ""RF016 - Copiar Itens de Avaliacao"" {	+  version ""1.5"" type ""Criacao"" user ""Carlos Diego"" date ""03/06/2022""	+  actor lider ""Lider de Pessoas""	+  preCondition ""Lider de Pessoas esta autenticado no sistema e tem permissao para copiar itens de avaliacoes""	+	+  basic {	+    step 1 lider ""acessa a funcionalidade 'Avaliacoes' a partir do menu inicial"" af[1]	+    step 2 system ""exibe a listagem das Avaliacoes cadastradas com a opcao 'Copiar' dentre as varias exibidas"" 	+    step 3 lider ""com uma Avaliacao selecionada, clica na opcao 'Copiar' para copia-la""	+    step 4 system ""apresenta o formulario para copiar a Avaliacao com os valores atuais ja preenchidos, exceto o 'Avaliado', que deve estar vazio""	+    step 5 lider  ""seleciona o 'Periodo Avaliativo' da Avaliacao""	+    step 6 system ""apresenta o campo 'Periodo Avaliativo' preenchido corretamente""	+    step 7 lider ""seleciona o colaborador a ser 'Avaliado' na Avaliacao""	+    step 8 system ""apresenta o campo 'Avaliado' preenchido corretamente""	+    step 9 lider ""escolhe que deseja 'fazer uma copia' do Perfil de Competencias"" af[2]	+    step 10 system ""apresenta o campo 'fazer uma copia' do Perfil de Competencias com a opcao 'SIM' selecionada""	+    step 11 lider ""preenche o 'nome' do novo Perfil de Competencias da Avaliacao""	+    step 12 system ""apresenta o campo 'nome' do novo Perfil de Competencias da Avaliacao preenchido corretamente""	+    step 13 lider ""clica na opcao 'Confirmar'"" af[3]	+    step 14 system ""apresenta uma mensagem de confirmacao referente a criacao do novo Perfil de Competencias""	+    step 15 lider ""confirma a operacao de criacao do novo Perfil de Competencias"" af[4]	+    step 16 system ""realiza a acao conforme a opcao selecionada pelo usuario e 	+				    retorna feedback correspondente"" ef[1,2]	+  }	+	+  alternative 1 ""Copiar Perfil de Competencias"" {	+    step 1 lider ""acessa a funcionalidade 'Catalogo (Perfis) de Competencias' a partir do menu inicial""	+    step 2 system ""exibe a listagem dos Perfis de Competencias com a opcao 'Copiar' dentre as varias exibidas""	+    step 3 lider ""com um Perfil de Competencias selecionado, clica na opcao 'Copiar' para copia-lo""	+    step 4 system ""apresenta o formulario para copiar o Perfil de Competencias com os valores atuais ja preenchidos""	+    step 5 lider  ""seleciona o 'Periodo Avaliativo' da Avaliacao""	+    step 6 system ""apresenta o campo 'Periodo Avaliativo' preenchido corretamente""	+    step 7 lider ""preenche o 'nome' do novo Perfil de Competencias da Avaliacao""	+    step 8 system ""apresenta o campo 'nome' do novo Perfil de Competencias preenchido corretamente"" 	+    step 9 lider ""clica na opcao 'Confirmar'"" bs 16	+  }	+  	+  alternative 2 ""Nao Fazer uma Copia do Perfil de Competencias"" {	+  	step 1 lider ""escolhe que nao deseja 'fazer uma copia' do Perfil de Competencias""	+    step 2 system ""apresenta o campo 'fazer uma copia' do Perfil de Competencias com a opcao 'NAO' selecionada""	+    step 3 lider ""seleciona um Perfil de Competencias dentre os disponiveis""	+    step 4 system ""apresenta o 'nome' do Perfil de Competencias existente escolhido"" 	+    step 5 lider ""clica na opcao 'Confirmar'"" bs 16	+  }	+  	+  alternative 3 ""Nao Confirmar a Copia do Perfil de Competencias"" {	+  	step 1 lider ""nao confirma a operacao de criacao do novo Perfil de Competencias""	+    step 2 system ""apresenta o formulario para copiar a Avaliacao com os valores ja preenchidos""	+  }	+  	+  alternative 4 ""Cancelar Copia do Perfil de Competencias"" {	+  	step 1 lider ""nao confirma a operacao de criacao do novo Perfil de Competencias""	+    step 2 system ""exibe a listagem de Avaliacoes sem uma nova avaliacao copiada""	+  }	+	+  exception 1 ""Falha ao Salvar a nova Avaliacao"" {	+    step 1 system ""exibe uma mensagem de erro ao tentar salvar a nova Avaliacao, informando o campo ou a validacao que falhou""	+  }	+	+  exception 2 ""Falha ao Fazer uma Copia do Perfil de Competencias"" {	+    step 1 system ""exibe uma mensagem de erro ao tentar copiar a Avaliacao, informando que o Perfil de Competencias com este nome ja existe""	+  }	+	+  postCondition ""A copia de itens de avaliacao e realizada com sucesso.""	+}	",HIGH,3,0,8,"{'TC3', 'TC11', 'TC6'}",11,HIGH,"The provided text suggests significant changes to the existing workflow and introduces new alternatives. Additionally, it modifies or adds several steps, exceptions, and alternative flows, which are all considered high-impact edits.",93216
98,src/RF017 - Gerenciar Metas de Desempenho.claret,exp01_gti-competencias_v1.4,exp01_gti-competencias_v1.5,"-    step 2 system ""exibe a listagem das Avaliacoes cadastradas com a opcao 'Editar' dentre as varias listadas"" 	","+    step 2 system ""exibe a listagem das Avaliacoes cadastradas com a opcao 'Editar' dentre as varias exibidas"" 	",LOW,0,2,0,"{'TC2', 'TC1'}",2,LOW,"The change is merely a textual update with no change in the system behavior, and does not introduce new requirements or delete existing ones.",129152
