index,filename,base_tag,head_tag,base_tag_lines_txt,head_tag_lines_txt,edit_classification_truth,new_ct,obsolete_ct,reusable_ct,affected_cts,total_ct,edit_classification,decision_rationale,elapsed_time_ms
0,src/RF001 - Autenticar Usuario.claret,exp01_gti-competencias_v0.1,exp01_gti-competencias_v1.0,"-    step 1 sysUser ""inicia a tela de login atraves da opcao de login no canto superior direito""	","+    step 1 sysUser ""inicia a tela de login atraves da opcao de Login no canto superior direito""	",LOW,0,14,0,"{'TC2', 'TC11', 'TC3', 'TC9', 'TC7', 'TC13', 'TC4', 'TC6', 'TC10', 'TC1', 'TC5', 'TC14', 'TC12', 'TC8'}",14,LOW,The change is a syntactic edit where the only difference is punctuation.,29561
1,src/RF002 - Realizar logout.claret,exp01_gti-competencias_v0.1,exp01_gti-competencias_v1.0,"-    step 1 sysUser ""clica na opcao de logout atraves da opcao disponivel no canto superior direito""	","+    step 1 sysUser ""clica na opcao de Logout atraves da opcao disponivel no canto superior direito""	",LOW,0,1,0,{'TC1'},1,LOW,"The change is a syntactic edit, correcting the capitalization of 'Logout'.",74689
2,src/RF003 - Visualizar Permissoes do Usuario.claret,exp01_gti-competencias_v0.1,exp01_gti-competencias_v1.0,"-    step 2 system ""exibe a tela com a tabela das permissoes concedidas ao seu usuario""	","+    step 2 system ""exibe a tela com a tabela das Permissoes concedidas ao seu usuario""	",LOW,0,1,0,{'TC1'},1,LOW,"The change in the updated snippet is a syntactic edit, as it only involves changing a lowercase to uppercase letter in the word 'Permissoes'. This does not alter the system behavior or introduce any new requirements or changes. The update appears to be mainly for formatting purposes.",81237
3,src/RF003 - Visualizar Permissoes do Usuario.claret,exp01_gti-competencias_v0.1,exp01_gti-competencias_v1.0,"-  postCondition ""Usuario visualiza a tabela das permissoes concedidas ao seu usuario""	","+  postCondition ""Usuario visualiza a tabela das Permissoes concedidas ao seu usuario""	",LOW,0,1,0,{'TC1'},1,LOW,"The change only modifies the capitalization of the word 'Permissoes' and is a textual (update) change. No changes to system behavior, requirements, features or business model entities are introduced.",83778
4,src/RF006 - Gerenciar Perfis de Competencias.claret,exp01_gti-competencias_v0.1,exp01_gti-competencias_v1.0,"-				tem permissao para gerenciar perfis de competencias.""	","+				tem permissao para gerenciar Perfis de Competencias.""	",LOW,0,11,0,"{'TC2', 'TC11', 'TC3', 'TC9', 'TC7', 'TC4', 'TC6', 'TC10', 'TC1', 'TC5', 'TC8'}",11,LOW,"The changes made are textual updates, specifically changing the capitalization of 'Perfis de Competencias'.",78656
5,src/RF006 - Gerenciar Perfis de Competencias.claret,exp01_gti-competencias_v0.1,exp01_gti-competencias_v1.0,"-    step 1 lider ""acessa a funcionalidade de gestao de perfis de competencias a partir do menu inicial"" af[4]	-    step 2 system ""exibe a listagem dos perfis de competencias cadastrados com opcoes de 'Novo', 'Editar', 'Excluir' e 'Ajuda'"" 	-    step 3 lider ""clica na opcao 'Novo' para criar um novo perfil"" af[1,2,3]	","+    step 1 lider ""acessa a funcionalidade de gestao de Perfis de Competencias a partir do menu inicial"" af[4]	+    step 2 system ""exibe a listagem dos Perfis de Competencias cadastrados com opcoes de 'Novo', 'Editar', 'Excluir' e 'Ajuda'"" 	+    step 3 lider ""clica na opcao 'Novo' para criar um Novo Perfil de Competencias"" af[1,2,3]	",LOW,0,4,7,"{'TC11', 'TC10', 'TC9', 'TC8'}",11,LOW,"The changes are mostly textual updates, such as capitalization and spacing. No changes in the system behavior or requirements were introduced.",79904
6,src/RF006 - Gerenciar Perfis de Competencias.claret,exp01_gti-competencias_v0.1,exp01_gti-competencias_v1.0,"-    step 6 system ""exibe a listagem dos perfis de competencias sem o perfil de competencias excluido""	","+    step 6 system ""exibe a listagem dos Perfis de Competencias sem o perfil de competencias excluido"" ef[3]	",LOW,0,1,10,{'TC3'},11,LOW,"The change is a syntactic edit, as it only changes the capitalization of 'Perfis de Competencias' and adds an exception flow reference (ef) to the existing step. The overall system behavior remains unchanged.",95218
7,src/RF006 - Gerenciar Perfis de Competencias.claret,exp01_gti-competencias_v0.1,exp01_gti-competencias_v1.0,"-    step 6 system ""exibe a listagem dos perfis de competencias com o perfil de competencias excluido""	","+    step 6 system ""exibe a listagem dos Perfis de Competencias com o perfil de competencias excluido""	",LOW,0,1,10,{'TC2'},11,LOW,"The change is a syntactic edit, as it only changes the capitalization of the words 'Perfis de Competencias'. This does not change the system behavior and is simply a textual update.",84447
8,src/RF006 - Gerenciar Perfis de Competencias.claret,exp01_gti-competencias_v0.1,exp01_gti-competencias_v1.0,"-  	step 1 usuarioNA ""acessa a funcionalidade de gestao de perfis de competencias a partir do menu inicial""	-  	step 2 system ""exibe a listagem dos perfis de competencias cadastrados apenas para visualizacao com a opcao 'Ajuda'""	","+  	step 1 usuarioNA ""acessa a funcionalidade de gestao de Perfis de Competencias a partir do menu inicial""	+  	step 2 system ""exibe a listagem dos Perfis de Competencias cadastrados apenas para visualizacao com a opcao 'Ajuda'""	",LOW,0,1,10,{'TC1'},11,LOW,"The changes in the snippet are minor textual updates which do not change the system behavior, and are only syntactic edits.",83450
9,src/RF006 - Gerenciar Perfis de Competencias.claret,exp01_gti-competencias_v0.1,exp01_gti-competencias_v1.0,"-  exception 1 ""Falha ao Salvar o Novo Perfil"" {	-    step 1 system ""exibe uma mensagem de erro ao tentar salvar o novo perfil, informando o campo ou a validacao que falhou""	","+  exception 1 ""Falha ao Salvar o Novo Perfil de Competencias"" {	+    step 1 system ""exibe uma mensagem de erro ao tentar salvar o novo Perfil de Competencias, informando o campo ou a validacao que falhou""	",LOW,0,2,9,"{'TC4', 'TC8'}",11,LOW,"The update changes the error message's detailing, but does not alter system behavior or introduce new requirements.",91097
10,src/RF006 - Gerenciar Perfis de Competencias.claret,exp01_gti-competencias_v0.1,exp01_gti-competencias_v1.0,"-  exception 2 ""Erro ao Editar Perfil"" {	-    step 1 system ""exibe uma mensagem de erro ao tentar editar o perfil, informando o campo ou a validacao que falhou""	","+  exception 2 ""Erro ao Editar Perfil de Competencias"" {	+    step 1 system ""exibe uma mensagem de erro ao tentar editar o Perfil de Competencias, informando o campo ou a validacao que falhou""	",LOW,0,2,9,"{'TC5', 'TC9'}",11,LOW,"The change is a textual update, where the exception flow name has been made more specific without changing the system behavior.",91869
11,src/RF006 - Gerenciar Perfis de Competencias.claret,exp01_gti-competencias_v0.1,exp01_gti-competencias_v1.0,"-  exception 3 ""Falha na Exclusao do Perfil"" {	-    step 1 system ""exibe uma mensagem de erro ao tentar excluir o perfil""	","+  exception 3 ""Falha na Exclusao do Perfil de Competencias"" {	+    step 1 system ""exibe uma mensagem de erro ao tentar excluir o Perfil de Competencias""	",LOW,0,2,9,"{'TC10', 'TC6'}",11,LOW,"The updated snippet only changes the error message's specificity, not altering the system behavior or any existing requirements.",91116
12,src/RF006 - Gerenciar Perfis de Competencias.claret,exp01_gti-competencias_v0.1,exp01_gti-competencias_v1.0,"-  postCondition ""A gestao de perfis de competencias e realizada com sucesso.""	","+  postCondition ""A gestao de Perfis de Competencias e realizada com sucesso.""	",LOW,0,2,9,"{'TC11', 'TC7'}",11,LOW,"The change is a simple formatting edit, with the addition of spaces around punctuation marks.",96443
13,src/RF007 - Gerenciar Avaliacoes.claret,exp01_gti-competencias_v0.1,exp01_gti-competencias_v1.0,,"+systemName ""GTI-Competencias""	+	+usecase ""RF007 - Gerenciar Avaliacoes"" {	+  version ""1.0"" type ""Criacao"" user ""Aislan Fernandes"" date ""03/08/2020""	+  actor lider ""Lider de Pessoas""	+  preCondition ""Lider de Pessoas esta autenticado no sistema; 	+				tem permissao para gerenciar Avaliacoes""	+	+  basic {	+    step 1 lider ""acessa a funcionalidade de gestao de Avaliacoes a partir do menu inicial""	+    step 2 system ""exibe a listagem dos Avaliacoes cadastrados com opcoes de 'Novo', 'Editar', 'Excluir' e 'Ajuda'"" 	+    step 3 lider ""clica na opcao 'Novo' para criar uma nova Avaliacao"" af[1,2,3]	+    step 4 system ""apresenta o formulario para cadastro e alteracao de Avaliacao""	+    step 5 lider  ""seleciona o 'Periodo Avaliativo' da Avaliacao""	+    step 6 system ""apresenta o campo 'Periodo Avaliativo' preenchido corretamente""	+    step 7 lider ""seleciona o 'Perfil' de competencias da Avaliacao""	+    step 8 system ""apresenta o campo 'Perfil' de competencias preenchido corretamente e	+                   apresenta o campo 'Metas' com as respectivas competencias, cada uma preenchida com nivel igual 1 (um)""	+    step 9 lider ""seleciona o colaborador a ser 'Avaliado' na Avaliacao""	+    step 10 system ""apresenta o campo 'Avaliado' preenchido corretamente""	+    step 11 lider ""Em 'Metas', insere o 'Nivel' esperado para cada competencia do perfil selecionado na Avaliacao""	+    step 12 system ""apresenta em 'Metas' os campos 'Nivel' preenchido corretamente""              	+    step 13 lider ""seleciona 'Avaliadores' da Avaliacao""	+    step 14 system ""apresenta a lista de 'Avaliadores' preenchida corretamente""	+	step 15 lider ""clica na opcao 'Salvar'""	+    step 16 system ""realiza a acao conforme a opcao selecionada pelo usuario e 	+				   retorna feedback correspondente"" ef[1,2]	+  }	+	+  alternative 1 ""Editar Avaliacao Existente"" {	+    step 1 lider ""seleciona uma Avaliacao da listagem""	+    step 2 system ""destaca a Avaliacao selecionada na listagem""	+    step 3 lider ""clica na opcao 'Editar' para modificar a Avaliacao selecionada""	+    step 4 system ""apresenta o formulario para e alteracao de Avaliacao""	+    step 5 lider ""verifica que os campos 'Periodo Avaliativo', 'Perfil' e 'Avaliado' somente leitura"" bs 11	+  }	+  	+  alternative 2 ""Confirmar Exclusao do Avaliacao"" {	+  	step 1 lider ""seleciona uma Avaliacao da listagem""	+    step 2 system ""destaca a Avaliacao selecionada na listagem""	+    step 3 lider ""clica na opcao 'Excluir' para excluir a Avaliacao selecionada"" 	+    step 4 system ""solicita confirmacao de exclusao da Avaliacao""	+    step 5 lider ""confirma a exclusao do Avaliacao""	+    step 6 system ""exibe a listagem dos Avaliacoes sem o Avaliacao excluido"" ef[3,4]	+  }	+	+  alternative 3 ""Negar Exclusao do Avaliacao"" {	+  	step 1 lider ""seleciona uma Avaliacao da listagem""	+    step 2 system ""destaca a Avaliacao selecionada na listagem""	+    step 3 lider ""clica na opcao 'Excluir' para excluir a Avaliacao selecionada""	+    step 4 system ""solicita confirmacao de exclusao da Avaliacao""	+    step 5 lider ""nao confirma a exclusao do Avaliacao""	+    step 6 system ""exibe a listagem dos Avaliacoes com o Avaliacao excluido""	+  }	+	+  exception 1 ""Falha ao Salvar a nova Avaliacao"" {	+    step 1 system ""exibe uma mensagem de erro ao tentar salvar a nova Avaliacao, informando o campo ou a validacao que falhou""	+  }	+	+  exception 2 ""Erro ao Editar Avaliacao"" {	+    step 1 system ""exibe uma mensagem de erro ao tentar editar a Avaliacao, informando o campo ou a validacao que falhou""	+  }	+	+  exception 3 ""Falha na Exclusao do Avaliacao"" {	+    step 1 system ""exibe uma mensagem de erro ao tentar excluir a Avaliacao""	+  }	+  	+  exception 4 ""Falha na Exclusao do Avaliacao: nao e o lider"" {	+    step 1 system ""exibe uma mensagem de erro ao tentar excluir a Avaliacao informando que o usuario nao e o lider""	+  }	+	+  postCondition ""A gestao de Avaliacoes e realizada com sucesso.""	+}	",HIGH,2,0,8,"{'TC10', 'TC7'}",10,HIGH,"The given text involves a significant change in the system's expected behavior, adding alternative flows and exceptions. This indicates that it is a high-impact edit.",89153
14,src/RF010 - Gerenciar Periodos Avaliativos.claret,exp01_gti-competencias_v0.1,exp01_gti-competencias_v1.0,"-				tem permissao para gerenciar perfis de competencias.""	","+				tem permissao para gerenciar Periodos Avaliativos.""	",LOW,0,11,0,"{'TC2', 'TC11', 'TC3', 'TC9', 'TC7', 'TC4', 'TC6', 'TC10', 'TC1', 'TC5', 'TC8'}",11,LOW,"The changes are merely textual, updating the terminology from 'permissoes' to 'Periodos Avaliativos', and do not change the system behavior or introduce new requirements. Therefore, the edit is considered low-impact.",143210
15,src/RF010 - Gerenciar Periodos Avaliativos.claret,exp01_gti-competencias_v0.1,exp01_gti-competencias_v1.0,"-    step 1 lider ""acessa a funcionalidade de gestao de perfis de competencias a partir do menu inicial"" af[4]	-    step 2 system ""exibe a listagem dos perfis de competencias cadastrados com opcoes de 'Novo', 'Editar', 'Excluir' e 'Ajuda'"" 	","+    step 1 lider ""acessa a funcionalidade de gestao de Periodos Avaliativos a partir do menu inicial"" af[4]	+    step 2 system ""exibe a listagem dos Periodos Avaliativos cadastrados com opcoes de 'Novo', 'Editar', 'Excluir' e 'Ajuda'"" 	",LOW,0,10,1,"{'TC2', 'TC11', 'TC3', 'TC9', 'TC7', 'TC4', 'TC6', 'TC10', 'TC5', 'TC8'}",11,HIGH,"The updated snippet changes the system expected behavior as it changes from 'gestao de perfis de competencias' to 'gestao de Periodos Avaliativos', which introduces a new requirement and deletes an existing one. This is considered high-impact because the functionalities being accessed are different, and this change affects how the system behaves.",112144
16,src/RF010 - Gerenciar Periodos Avaliativos.claret,exp01_gti-competencias_v0.1,exp01_gti-competencias_v1.0,"-    step 7 lider ""preenche o campo 'Data Inicial e Data Final' selecionando um lider da lista""	","+    step 7 lider ""preenche o campo 'Data Inicial e Data Final' informando as respectivas datas referente ao periodo""	",LOW,0,8,3,"{'TC11', 'TC9', 'TC7', 'TC4', 'TC6', 'TC10', 'TC5', 'TC8'}",11,LOW,"The original and updated snippets describe the same action with slightly different wording, indicating a change in phrasing rather than system behavior. The change is not altering the expected outcome of the use case but merely changing the way it's described.",99496
17,src/RF010 - Gerenciar Periodos Avaliativos.claret,exp01_gti-competencias_v0.1,exp01_gti-competencias_v1.0,"-    step 6 system ""exibe a listagem dos perfis de competencias sem o Periodo Avaliativo excluido""	","+    step 6 system ""exibe a listagem dos Periodos Avaliativos sem o Periodo Avaliativo excluido"" ef[3]	",HIGH,0,1,10,{'TC3'},11,HIGH,The change alters the expected behavior of the system by changing the output from displaying the list of competency profiles without the Periodo Avaliativo excluded to showing the Periodos Avaliativos excluindo o Periodo Avaliativo. This represents a significant semantic change in the use case.,88257
18,src/RF010 - Gerenciar Periodos Avaliativos.claret,exp01_gti-competencias_v0.1,exp01_gti-competencias_v1.0,"-    step 6 system ""exibe a listagem dos perfis de competencias com o Periodo Avaliativo excluido""	","+    step 6 system ""exibe a listagem dos Periodos Avaliativos com o Periodo Avaliativo excluido""	",LOW,0,1,10,{'TC2'},11,LOW,"The change is a simple textual update, changing the object of focus from 'perfis de competencias' to 'Periodos Avaliativos'. This does not change the overall system behavior or the flow of the use case.",90050
19,src/RF010 - Gerenciar Periodos Avaliativos.claret,exp01_gti-competencias_v0.1,exp01_gti-competencias_v1.0,"-  	step 1 usuarioNA ""acessa a funcionalidade de gestao de perfis de competencias a partir do menu inicial""	-  	step 2 system ""exibe a listagem dos perfis de competencias cadastrados apenas para visualizacao com a opcao 'Ajuda'""	","+  	step 1 usuarioNA ""acessa a funcionalidade de gestao de Periodos Avaliativos a partir do menu inicial""	+  	step 2 system ""exibe a listagem dos Periodos Avaliativos cadastrados apenas para visualizacao com a opcao 'Ajuda'""	",LOW,0,1,10,{'TC1'},11,HIGH,"The updated snippet changes the expected behavior of the system by altering the functionality from managing competency profiles to managing Periods Evaluativos, which is a significant difference.",97618
20,src/RF010 - Gerenciar Periodos Avaliativos.claret,exp01_gti-competencias_v0.1,exp01_gti-competencias_v1.0,"-  postCondition ""A gestao de perfis de competencias e realizada com sucesso.""	","+  postCondition ""A gestao de Periodos Avaliativos e realizada com sucesso.""	",LOW,0,2,9,"{'TC11', 'TC7'}",11,LOW,"The change only updates the text of the postCondition, not changing the system behavior or introducing new elements.",92604
21,src/RF011 - Gerenciar Competencias Portfolio.claret,exp01_gti-competencias_v0.1,exp01_gti-competencias_v1.0,"-				tem permissao para gerenciar competencias (portfolio).""	","+				tem permissao para gerenciar Competencias (Portfolio).""	",LOW,0,35,0,"{'TC3', 'TC32', 'TC9', 'TC24', 'TC26', 'TC22', 'TC1', 'TC5', 'TC14', 'TC30', 'TC8', 'TC33', 'TC34', 'TC10', 'TC18', 'TC28', 'TC29', 'TC35', 'TC12', 'TC31', 'TC2', 'TC13', 'TC7', 'TC20', 'TC4', 'TC6', 'TC23', 'TC16', 'TC21', 'TC17', 'TC25', 'TC11', 'TC27', 'TC15', 'TC19'}",35,LOW,"The change is a textual update, specifically the capitalization of the word 'competencias' and 'Portfolio'. This does not affect the system behavior or expected output.",90421
22,src/RF011 - Gerenciar Competencias Portfolio.claret,exp01_gti-competencias_v0.1,exp01_gti-competencias_v1.0,"-    step 1 lider ""acessa a funcionalidade de gestao de competencias (portfolio) a partir do menu inicial"" af[4]	-    step 2 system ""exibe a listagem dos competencias (portfolio) cadastrados com opcoes de 'Novo', 'Editar', 'Excluir' e 'Ajuda'"" 	","+    step 1 lider ""acessa a funcionalidade de gestao de Competencias (Portfolio) a partir do menu inicial"" af[4]	+    step 2 system ""exibe a listagem dos Competencias (Portfolio) cadastrados com opcoes de 'Novo', 'Editar', 'Excluir' e 'Ajuda'"" 	",LOW,0,34,1,"{'TC3', 'TC32', 'TC9', 'TC24', 'TC26', 'TC22', 'TC5', 'TC14', 'TC30', 'TC8', 'TC33', 'TC34', 'TC10', 'TC18', 'TC28', 'TC29', 'TC35', 'TC12', 'TC31', 'TC2', 'TC13', 'TC7', 'TC20', 'TC4', 'TC6', 'TC23', 'TC16', 'TC21', 'TC17', 'TC25', 'TC11', 'TC27', 'TC15', 'TC19'}",35,LOW,"The changes are only textual updates, with no impact on the system behavior or requirements.",83830
23,src/RF011 - Gerenciar Competencias Portfolio.claret,exp01_gti-competencias_v0.1,exp01_gti-competencias_v1.0,"-    step 4 system ""apresenta o formulario para cadastro e alteracao de competecias (portfolio)""	","+    step 4 system ""apresenta o formulario para cadastro e alteracao de Competencias (Portfolio)""	",LOW,0,32,3,"{'TC32', 'TC9', 'TC24', 'TC26', 'TC22', 'TC5', 'TC14', 'TC30', 'TC8', 'TC33', 'TC34', 'TC10', 'TC18', 'TC28', 'TC29', 'TC35', 'TC12', 'TC31', 'TC13', 'TC7', 'TC20', 'TC4', 'TC6', 'TC23', 'TC16', 'TC21', 'TC17', 'TC25', 'TC11', 'TC27', 'TC15', 'TC19'}",35,LOW,The change is a simple case of capitalization and punctuation which does not alter the system's behavior or requirements. It only improves readability.,89760
24,src/RF011 - Gerenciar Competencias Portfolio.claret,exp01_gti-competencias_v0.1,exp01_gti-competencias_v1.0,"-  alternative 1 ""Editar competecias (portfolio) Existente"" {	-    step 1 lider ""seleciona um competecias (portfolio) da listagem""	-    step 2 system ""destaca o competecias (portfolio) selecionado na listagem""	-    step 3 lider ""clica na opcao 'Editar' para modificar o competecias (portfolio) selecionado"" bs 4	","+  alternative 1 ""Editar Competencias (Portfolio) Existente"" {	+    step 1 lider ""seleciona um Competencias (Portfolio) da listagem""	+    step 2 system ""destaca o Competencias (Portfolio) selecionado na listagem""	+    step 3 lider ""clica na opcao 'Editar' para modificar o Competencias (Portfolio) selecionado"" bs 4	",LOW,0,16,19,"{'TC11', 'TC9', 'TC7', 'TC13', 'TC4', 'TC6', 'TC19', 'TC10', 'TC16', 'TC18', 'TC15', 'TC17', 'TC5', 'TC14', 'TC12', 'TC8'}",35,LOW,"The updated snippet only changes the capitalization and punctuation of some terms, which are textual updates. The system behavior has not changed.",85833
25,src/RF011 - Gerenciar Competencias Portfolio.claret,exp01_gti-competencias_v0.1,exp01_gti-competencias_v1.0,"-  alternative 2 ""Confirmar Exclusao do competecias (portfolio)"" {	-  	step 1 lider ""seleciona um competecias (portfolio) da listagem""	-    step 2 system ""destaca o competecias (portfolio) selecionado na listagem""	-    step 3 lider ""clica na opcao 'Excluir' para excluir o competecias (portfolio) selecionado""	","+  alternative 2 ""Confirmar Exclusao do Competencias (Portfolio)"" {	+  	step 1 lider ""seleciona um Competencias (Portfolio) da listagem""	+    step 2 system ""destaca o Competencias (Portfolio) selecionado na listagem""	+    step 3 lider ""clica na opcao 'Excluir' para excluir o Competencias (Portfolio) selecionado""	",LOW,0,2,33,"{'TC2', 'TC3'}",35,LOW,"The changes are textual updates without changing the system behavior. It includes capitalization of terms and renaming, but no new requirement or step is introduced.",91197
26,src/RF011 - Gerenciar Competencias Portfolio.claret,exp01_gti-competencias_v0.1,exp01_gti-competencias_v1.0,"-    step 6 system ""exibe a listagem dos competencias (portfolio) sem o competecias (portfolio) excluido""	","+    step 6 system ""exibe a listagem dos Competencias (Portfolio) sem o Competencias (Portfolio) excluido"" ef[3]	",HIGH,0,1,34,{'TC3'},35,LOW,"The changes are purely textual, correcting capitalization and adding spaces. There is no change in system behavior.",92043
27,src/RF011 - Gerenciar Competencias Portfolio.claret,exp01_gti-competencias_v0.1,exp01_gti-competencias_v1.0,"-  alternative 3 ""Negar Exclusao do competecias (portfolio)"" {	-  	step 1 lider ""seleciona um competecias (portfolio) da listagem""	-    step 2 system ""destaca o competecias (portfolio) selecionado na listagem""	-    step 3 lider ""clica na opcao 'Excluir' para excluir o competecias (portfolio) selecionado""	","+  alternative 3 ""Negar Exclusao do Competencias (Portfolio)"" {	+  	step 1 lider ""seleciona um Competencias (Portfolio) da listagem""	+    step 2 system ""destaca o Competencias (Portfolio) selecionado na listagem""	+    step 3 lider ""clica na opcao 'Excluir' para excluir o Competencias (Portfolio) selecionado""	",LOW,0,2,33,"{'TC2', 'TC3'}",35,LOW,"The changes are textual updates, such as capitalization and punctuation. There is no change in the system's expected behavior or semantics.",89253
28,src/RF011 - Gerenciar Competencias Portfolio.claret,exp01_gti-competencias_v0.1,exp01_gti-competencias_v1.0,"-    step 6 system ""exibe a listagem dos competencias (portfolio) com o competecias (portfolio) excluido""	","+    step 6 system ""exibe a listagem dos Competencias (Portfolio) com o Competencias (Portfolio) excluido""	",LOW,0,1,34,{'TC2'},35,LOW,"The change is a syntactic edit where the capitalization and punctuation of certain words are corrected. This doesn't alter the system behavior or add/remove any requirements, steps, or flows.",94747
29,src/RF011 - Gerenciar Competencias Portfolio.claret,exp01_gti-competencias_v0.1,exp01_gti-competencias_v1.0,"-  	step 1 usuarioNA ""acessa a funcionalidade de gestao de competencias (portfolio) a partir do menu inicial""	-  	step 2 system ""exibe a listagem dos competencias (portfolio) cadastrados apenas para visualizacao com a opcao 'Ajuda'""	","+  	step 1 usuarioNA ""acessa a funcionalidade de gestao de Competencias (Portfolio) a partir do menu inicial""	+  	step 2 system ""exibe a listagem dos Competencias (Portfolio) cadastrados apenas para visualizacao com a opcao 'Ajuda'""	",LOW,0,1,34,{'TC1'},35,LOW,The changes are purely syntactic and do not change the system behavior or requirements. There is no addition or removal of any element in the use case.,86609
30,src/RF011 - Gerenciar Competencias Portfolio.claret,exp01_gti-competencias_v0.1,exp01_gti-competencias_v1.0,"-  postCondition ""A gestao de competencias (portfolio) e realizada com sucesso.""	","+  postCondition ""A gestao de Competencias (Portfolio) e realizada com sucesso.""	",LOW,0,8,27,"{'TC11', 'TC7', 'TC27', 'TC23', 'TC15', 'TC35', 'TC31', 'TC19'}",35,LOW,"The updated snippet only changes the capitalization and punctuation of a single word in the postCondition. This does not change the system behavior, as it is purely a textual update.",82004
