index,filename,base_tag,head_tag,base_tag_lines_txt,head_tag_lines_txt,edit_classification_truth,new_ct,obsolete_ct,reusable_ct,affected_cts,total_ct,edit_classification,decision_rationale,elapsed_time_ms
0,src/RF001 - Autenticar Usuario.claret,exp01_gti-competencias_v0.1,exp01_gti-competencias_v1.0,"-    step 1 sysUser ""inicia a tela de login atraves da opcao de login no canto superior direito""	","+    step 1 sysUser ""inicia a tela de login atraves da opcao de Login no canto superior direito""	",LOW,0,14,0,"{'TC11', 'TC14', 'TC9', 'TC2', 'TC13', 'TC5', 'TC12', 'TC4', 'TC10', 'TC8', 'TC6', 'TC1', 'TC3', 'TC7'}",14,LOW,"The change is a low-impact syntactic edit, as it only modifies the alternative flow reference number from 'af[3,6]' to 'af[3,5]', without altering system behavior or introducing new/deleting requirements, features, business model entities, steps, exception flows, or alternative flows.",293388
1,src/RF002 - Realizar logout.claret,exp01_gti-competencias_v0.1,exp01_gti-competencias_v1.0,"-    step 1 sysUser ""clica na opcao de logout atraves da opcao disponivel no canto superior direito""	","+    step 1 sysUser ""clica na opcao de Logout atraves da opcao disponivel no canto superior direito""	",LOW,0,1,0,{'TC1'},1,LOW,"The change is a textual update, as it modifies the action descriptions without altering system behavior. It replaces 'Informa que acompanha autoridade' with 'Seleciona a justificativa', and adds a new step 'Seleciona o(s) beneficiarios da(s) diaria(s)'.",74605
2,src/RF003 - Visualizar Permissoes do Usuario.claret,exp01_gti-competencias_v0.1,exp01_gti-competencias_v1.0,"-    step 2 system ""exibe a tela com a tabela das permissoes concedidas ao seu usuario""	","+    step 2 system ""exibe a tela com a tabela das Permissoes concedidas ao seu usuario""	",LOW,0,1,0,{'TC1'},1,LOW,"The updated snippet removes steps 25-27 from the original snippet but maintains the same functionality. The system's behavior remains unchanged, as it still confirms the account existence, calculates the value of the daily allowances with the form information, and alters the status to SOLICITADA.",82579
3,src/RF003 - Visualizar Permissoes do Usuario.claret,exp01_gti-competencias_v0.1,exp01_gti-competencias_v1.0,"-  postCondition ""Usuario visualiza a tabela das permissoes concedidas ao seu usuario""	","+  postCondition ""Usuario visualiza a tabela das Permissoes concedidas ao seu usuario""	",LOW,0,1,0,{'TC1'},1,HIGH,"The change modifies the system's expected behavior by replacing an alternative flow (Usuário informa que NÃO acompanha autoridade) with a new one (Limpar Campos), which is considered a semantic edit.",55298
4,src/RF006 - Gerenciar Perfis de Competencias.claret,exp01_gti-competencias_v0.1,exp01_gti-competencias_v1.0,"-				tem permissao para gerenciar perfis de competencias.""	","+				tem permissao para gerenciar Perfis de Competencias.""	",LOW,0,11,0,"{'TC11', 'TC9', 'TC2', 'TC5', 'TC4', 'TC10', 'TC8', 'TC6', 'TC1', 'TC3', 'TC7'}",11,HIGH,"The original snippet contains an exception flow, while the updated snippet has no content. This change represents a high-impact edit since it removes the system's expected behavior (semantic edit) concerning error handling.",50604
5,src/RF006 - Gerenciar Perfis de Competencias.claret,exp01_gti-competencias_v0.1,exp01_gti-competencias_v1.0,"-    step 1 lider ""acessa a funcionalidade de gestao de perfis de competencias a partir do menu inicial"" af[4]	-    step 2 system ""exibe a listagem dos perfis de competencias cadastrados com opcoes de 'Novo', 'Editar', 'Excluir' e 'Ajuda'"" 	-    step 3 lider ""clica na opcao 'Novo' para criar um novo perfil"" af[1,2,3]	","+    step 1 lider ""acessa a funcionalidade de gestao de Perfis de Competencias a partir do menu inicial"" af[4]	+    step 2 system ""exibe a listagem dos Perfis de Competencias cadastrados com opcoes de 'Novo', 'Editar', 'Excluir' e 'Ajuda'"" 	+    step 3 lider ""clica na opcao 'Novo' para criar um Novo Perfil de Competencias"" af[1,2,3]	",LOW,0,4,7,"{'TC11', 'TC10', 'TC9', 'TC8'}",11,HIGH,"The updated snippet introduces a new use case, UC007 - Listar Autorizações de Pagamento Pendentes, which includes several steps, alternatives, and post-condition. This change clearly modifies the system's expected behavior, falling under high-impact edits.",87719
6,src/RF006 - Gerenciar Perfis de Competencias.claret,exp01_gti-competencias_v0.1,exp01_gti-competencias_v1.0,"-    step 6 system ""exibe a listagem dos perfis de competencias sem o perfil de competencias excluido""	","+    step 6 system ""exibe a listagem dos Perfis de Competencias sem o perfil de competencias excluido"" ef[3]	",LOW,0,1,10,{'TC3'},11,HIGH,"The updated snippet introduces a new use case 'UC008 - Registrar Autorização de Pagamento' in the system 'RGP-Diarias', which changes the system's expected behavior. It includes defining a new actor, preconditions, basic flow with steps, and exception flows.",81541
7,src/RF006 - Gerenciar Perfis de Competencias.claret,exp01_gti-competencias_v0.1,exp01_gti-competencias_v1.0,"-    step 6 system ""exibe a listagem dos perfis de competencias com o perfil de competencias excluido""	","+    step 6 system ""exibe a listagem dos Perfis de Competencias com o perfil de competencias excluido""	",LOW,0,1,10,{'TC2'},11,HIGH,"The change includes a new alternative flow ('Enviar prestação de contas') with multiple steps and conditions, which modifies the system's behavior significantly.",61638
8,src/RF006 - Gerenciar Perfis de Competencias.claret,exp01_gti-competencias_v0.1,exp01_gti-competencias_v1.0,"-  	step 1 usuarioNA ""acessa a funcionalidade de gestao de perfis de competencias a partir do menu inicial""	-  	step 2 system ""exibe a listagem dos perfis de competencias cadastrados apenas para visualizacao com a opcao 'Ajuda'""	","+  	step 1 usuarioNA ""acessa a funcionalidade de gestao de Perfis de Competencias a partir do menu inicial""	+  	step 2 system ""exibe a listagem dos Perfis de Competencias cadastrados apenas para visualizacao com a opcao 'Ajuda'""	",LOW,0,1,10,{'TC1'},11,HIGH,The updated snippet introduces a new use case 'UC010 - Analisar Prestação de Contas' which was not present in the original snippet. This is a high-impact change as it adds a new requirement to the system.,101524
9,src/RF006 - Gerenciar Perfis de Competencias.claret,exp01_gti-competencias_v0.1,exp01_gti-competencias_v1.0,"-  exception 1 ""Falha ao Salvar o Novo Perfil"" {	-    step 1 system ""exibe uma mensagem de erro ao tentar salvar o novo perfil, informando o campo ou a validacao que falhou""	","+  exception 1 ""Falha ao Salvar o Novo Perfil de Competencias"" {	+    step 1 system ""exibe uma mensagem de erro ao tentar salvar o novo Perfil de Competencias, informando o campo ou a validacao que falhou""	",LOW,0,2,9,"{'TC4', 'TC8'}",11,LOW,The change is textual and provides more detail on the verification step without altering the system's behavior.,42218
10,src/RF006 - Gerenciar Perfis de Competencias.claret,exp01_gti-competencias_v0.1,exp01_gti-competencias_v1.0,"-  exception 2 ""Erro ao Editar Perfil"" {	-    step 1 system ""exibe uma mensagem de erro ao tentar editar o perfil, informando o campo ou a validacao que falhou""	","+  exception 2 ""Erro ao Editar Perfil de Competencias"" {	+    step 1 system ""exibe uma mensagem de erro ao tentar editar o Perfil de Competencias, informando o campo ou a validacao que falhou""	",LOW,0,2,9,"{'TC5', 'TC9'}",11,LOW,"The change is purely textual, adding a detail to the existing step without altering the system's behavior.",40976
11,src/RF006 - Gerenciar Perfis de Competencias.claret,exp01_gti-competencias_v0.1,exp01_gti-competencias_v1.0,"-  exception 3 ""Falha na Exclusao do Perfil"" {	-    step 1 system ""exibe uma mensagem de erro ao tentar excluir o perfil""	","+  exception 3 ""Falha na Exclusao do Perfil de Competencias"" {	+    step 1 system ""exibe uma mensagem de erro ao tentar excluir o Perfil de Competencias""	",LOW,0,2,9,"{'TC6', 'TC10'}",11,LOW,"The change is related to the alternative flow (af) number, which does not introduce new or delete any requirement, feature, business model entity, step, exception flow or alternative flow. It is merely a numeric update.",59115
12,src/RF006 - Gerenciar Perfis de Competencias.claret,exp01_gti-competencias_v0.1,exp01_gti-competencias_v1.0,"-  postCondition ""A gestao de perfis de competencias e realizada com sucesso.""	","+  postCondition ""A gestao de Perfis de Competencias e realizada com sucesso.""	",LOW,0,2,9,"{'TC11', 'TC7'}",11,HIGH,"The original snippet shows an alternative flow 'Período com dias alternados' in the use case, whereas the updated snippet is missing this information entirely. This is a high-impact change as it alters the system's expected behavior by removing an alternative flow.",59121
13,src/RF007 - Gerenciar Avaliacoes.claret,exp01_gti-competencias_v0.1,exp01_gti-competencias_v1.0,,"+systemName ""GTI-Competencias""	+	+usecase ""RF007 - Gerenciar Avaliacoes"" {	+  version ""1.0"" type ""Criacao"" user ""Aislan Fernandes"" date ""03/08/2020""	+  actor lider ""Lider de Pessoas""	+  preCondition ""Lider de Pessoas esta autenticado no sistema; 	+				tem permissao para gerenciar Avaliacoes""	+	+  basic {	+    step 1 lider ""acessa a funcionalidade de gestao de Avaliacoes a partir do menu inicial""	+    step 2 system ""exibe a listagem dos Avaliacoes cadastrados com opcoes de 'Novo', 'Editar', 'Excluir' e 'Ajuda'"" 	+    step 3 lider ""clica na opcao 'Novo' para criar uma nova Avaliacao"" af[1,2,3]	+    step 4 system ""apresenta o formulario para cadastro e alteracao de Avaliacao""	+    step 5 lider  ""seleciona o 'Periodo Avaliativo' da Avaliacao""	+    step 6 system ""apresenta o campo 'Periodo Avaliativo' preenchido corretamente""	+    step 7 lider ""seleciona o 'Perfil' de competencias da Avaliacao""	+    step 8 system ""apresenta o campo 'Perfil' de competencias preenchido corretamente e	+                   apresenta o campo 'Metas' com as respectivas competencias, cada uma preenchida com nivel igual 1 (um)""	+    step 9 lider ""seleciona o colaborador a ser 'Avaliado' na Avaliacao""	+    step 10 system ""apresenta o campo 'Avaliado' preenchido corretamente""	+    step 11 lider ""Em 'Metas', insere o 'Nivel' esperado para cada competencia do perfil selecionado na Avaliacao""	+    step 12 system ""apresenta em 'Metas' os campos 'Nivel' preenchido corretamente""              	+    step 13 lider ""seleciona 'Avaliadores' da Avaliacao""	+    step 14 system ""apresenta a lista de 'Avaliadores' preenchida corretamente""	+	step 15 lider ""clica na opcao 'Salvar'""	+    step 16 system ""realiza a acao conforme a opcao selecionada pelo usuario e 	+				   retorna feedback correspondente"" ef[1,2]	+  }	+	+  alternative 1 ""Editar Avaliacao Existente"" {	+    step 1 lider ""seleciona uma Avaliacao da listagem""	+    step 2 system ""destaca a Avaliacao selecionada na listagem""	+    step 3 lider ""clica na opcao 'Editar' para modificar a Avaliacao selecionada""	+    step 4 system ""apresenta o formulario para e alteracao de Avaliacao""	+    step 5 lider ""verifica que os campos 'Periodo Avaliativo', 'Perfil' e 'Avaliado' somente leitura"" bs 11	+  }	+  	+  alternative 2 ""Confirmar Exclusao do Avaliacao"" {	+  	step 1 lider ""seleciona uma Avaliacao da listagem""	+    step 2 system ""destaca a Avaliacao selecionada na listagem""	+    step 3 lider ""clica na opcao 'Excluir' para excluir a Avaliacao selecionada"" 	+    step 4 system ""solicita confirmacao de exclusao da Avaliacao""	+    step 5 lider ""confirma a exclusao do Avaliacao""	+    step 6 system ""exibe a listagem dos Avaliacoes sem o Avaliacao excluido"" ef[3,4]	+  }	+	+  alternative 3 ""Negar Exclusao do Avaliacao"" {	+  	step 1 lider ""seleciona uma Avaliacao da listagem""	+    step 2 system ""destaca a Avaliacao selecionada na listagem""	+    step 3 lider ""clica na opcao 'Excluir' para excluir a Avaliacao selecionada""	+    step 4 system ""solicita confirmacao de exclusao da Avaliacao""	+    step 5 lider ""nao confirma a exclusao do Avaliacao""	+    step 6 system ""exibe a listagem dos Avaliacoes com o Avaliacao excluido""	+  }	+	+  exception 1 ""Falha ao Salvar a nova Avaliacao"" {	+    step 1 system ""exibe uma mensagem de erro ao tentar salvar a nova Avaliacao, informando o campo ou a validacao que falhou""	+  }	+	+  exception 2 ""Erro ao Editar Avaliacao"" {	+    step 1 system ""exibe uma mensagem de erro ao tentar editar a Avaliacao, informando o campo ou a validacao que falhou""	+  }	+	+  exception 3 ""Falha na Exclusao do Avaliacao"" {	+    step 1 system ""exibe uma mensagem de erro ao tentar excluir a Avaliacao""	+  }	+  	+  exception 4 ""Falha na Exclusao do Avaliacao: nao e o lider"" {	+    step 1 system ""exibe uma mensagem de erro ao tentar excluir a Avaliacao informando que o usuario nao e o lider""	+  }	+	+  postCondition ""A gestao de Avaliacoes e realizada com sucesso.""	+}	",HIGH,2,0,8,"{'TC7', 'TC10'}",10,LOW,"The change is textual in nature, adding information about presenting the justification and detail in the diárias's detailed view. It does not alter the system's behavior or introduce new requirements.",49841
14,src/RF010 - Gerenciar Periodos Avaliativos.claret,exp01_gti-competencias_v0.1,exp01_gti-competencias_v1.0,"-				tem permissao para gerenciar perfis de competencias.""	","+				tem permissao para gerenciar Periodos Avaliativos.""	",LOW,0,11,0,"{'TC11', 'TC9', 'TC2', 'TC5', 'TC4', 'TC10', 'TC8', 'TC6', 'TC1', 'TC3', 'TC7'}",11,LOW,"The change is only textual, adding 'dados do beneficiário' to the system response, which does not alter the system's behavior nor introduce new requirements or features.",50260
15,src/RF010 - Gerenciar Periodos Avaliativos.claret,exp01_gti-competencias_v0.1,exp01_gti-competencias_v1.0,"-    step 1 lider ""acessa a funcionalidade de gestao de perfis de competencias a partir do menu inicial"" af[4]	-    step 2 system ""exibe a listagem dos perfis de competencias cadastrados com opcoes de 'Novo', 'Editar', 'Excluir' e 'Ajuda'"" 	","+    step 1 lider ""acessa a funcionalidade de gestao de Periodos Avaliativos a partir do menu inicial"" af[4]	+    step 2 system ""exibe a listagem dos Periodos Avaliativos cadastrados com opcoes de 'Novo', 'Editar', 'Excluir' e 'Ajuda'"" 	",LOW,0,10,1,"{'TC11', 'TC9', 'TC2', 'TC5', 'TC4', 'TC10', 'TC8', 'TC6', 'TC3', 'TC7'}",11,LOW,"The change is purely textual - it replaces 'Visualiza' with 'Verifica', which does not alter the system's expected behavior or introduce new requirements, features, or entities.",60227
16,src/RF010 - Gerenciar Periodos Avaliativos.claret,exp01_gti-competencias_v0.1,exp01_gti-competencias_v1.0,"-    step 7 lider ""preenche o campo 'Data Inicial e Data Final' selecionando um lider da lista""	","+    step 7 lider ""preenche o campo 'Data Inicial e Data Final' informando as respectivas datas referente ao periodo""	",LOW,0,8,3,"{'TC11', 'TC9', 'TC5', 'TC4', 'TC10', 'TC8', 'TC6', 'TC7'}",11,LOW,"The change is a textual update, replacing 'dados básicos da solicitação' with 'nome do beneficiário, dados básicos da solicitação', which does not alter the system behavior.",53176
17,src/RF010 - Gerenciar Periodos Avaliativos.claret,exp01_gti-competencias_v0.1,exp01_gti-competencias_v1.0,"-    step 6 system ""exibe a listagem dos perfis de competencias sem o Periodo Avaliativo excluido""	","+    step 6 system ""exibe a listagem dos Periodos Avaliativos sem o Periodo Avaliativo excluido"" ef[3]	",HIGH,0,1,10,{'TC3'},11,LOW,"The change is a textual update, providing more detail to the existing step without altering the system's behavior.",37626
18,src/RF010 - Gerenciar Periodos Avaliativos.claret,exp01_gti-competencias_v0.1,exp01_gti-competencias_v1.0,"-    step 6 system ""exibe a listagem dos perfis de competencias com o Periodo Avaliativo excluido""	","+    step 6 system ""exibe a listagem dos Periodos Avaliativos com o Periodo Avaliativo excluido""	",LOW,0,1,10,{'TC2'},11,LOW,"The change is a textual update, adding a new step in the use case without altering the system's expected behavior.",40509
19,src/RF010 - Gerenciar Periodos Avaliativos.claret,exp01_gti-competencias_v0.1,exp01_gti-competencias_v1.0,"-  	step 1 usuarioNA ""acessa a funcionalidade de gestao de perfis de competencias a partir do menu inicial""	-  	step 2 system ""exibe a listagem dos perfis de competencias cadastrados apenas para visualizacao com a opcao 'Ajuda'""	","+  	step 1 usuarioNA ""acessa a funcionalidade de gestao de Periodos Avaliativos a partir do menu inicial""	+  	step 2 system ""exibe a listagem dos Periodos Avaliativos cadastrados apenas para visualizacao com a opcao 'Ajuda'""	",LOW,0,1,10,{'TC1'},11,LOW,"The change is a low-impact syntactic edit, as it only adds an alternative flow reference (af[4]) without modifying the action text.",43758
20,src/RF010 - Gerenciar Periodos Avaliativos.claret,exp01_gti-competencias_v0.1,exp01_gti-competencias_v1.0,"-  postCondition ""A gestao de perfis de competencias e realizada com sucesso.""	","+  postCondition ""A gestao de Periodos Avaliativos e realizada com sucesso.""	",LOW,0,2,9,"{'TC11', 'TC7'}",11,LOW,"The change is a low-impact addition of an alternative flow to the use case, which does not alter the system's expected behavior and introduces no new requirements or entities.",52487
21,src/RF011 - Gerenciar Competencias Portfolio.claret,exp01_gti-competencias_v0.1,exp01_gti-competencias_v1.0,"-				tem permissao para gerenciar competencias (portfolio).""	","+				tem permissao para gerenciar Competencias (Portfolio).""	",LOW,0,35,0,"{'TC14', 'TC9', 'TC35', 'TC3', 'TC11', 'TC19', 'TC16', 'TC2', 'TC5', 'TC12', 'TC23', 'TC15', 'TC8', 'TC30', 'TC18', 'TC25', 'TC7', 'TC31', 'TC21', 'TC10', 'TC34', 'TC6', 'TC29', 'TC24', 'TC22', 'TC26', 'TC17', 'TC20', 'TC13', 'TC28', 'TC4', 'TC1', 'TC32', 'TC27', 'TC33'}",35,LOW,"The updated snippet does not change the system behavior, it only adds an exception flow ef[5] to step 22. This is a low-impact change as it doesn't introduce new requirements or delete any steps, and it simply adds an alternative behavior for a specific condition.",64318
22,src/RF011 - Gerenciar Competencias Portfolio.claret,exp01_gti-competencias_v0.1,exp01_gti-competencias_v1.0,"-    step 1 lider ""acessa a funcionalidade de gestao de competencias (portfolio) a partir do menu inicial"" af[4]	-    step 2 system ""exibe a listagem dos competencias (portfolio) cadastrados com opcoes de 'Novo', 'Editar', 'Excluir' e 'Ajuda'"" 	","+    step 1 lider ""acessa a funcionalidade de gestao de Competencias (Portfolio) a partir do menu inicial"" af[4]	+    step 2 system ""exibe a listagem dos Competencias (Portfolio) cadastrados com opcoes de 'Novo', 'Editar', 'Excluir' e 'Ajuda'"" 	",LOW,0,34,1,"{'TC14', 'TC9', 'TC35', 'TC3', 'TC11', 'TC19', 'TC16', 'TC2', 'TC5', 'TC12', 'TC23', 'TC15', 'TC8', 'TC30', 'TC18', 'TC25', 'TC7', 'TC31', 'TC21', 'TC10', 'TC34', 'TC6', 'TC29', 'TC24', 'TC22', 'TC26', 'TC17', 'TC20', 'TC13', 'TC28', 'TC4', 'TC32', 'TC27', 'TC33'}",35,LOW,"The updated snippet adds an exception flow to the use case, which does not change the system's overall behavior or introduce new requirements, features, or business model entities. The change is related to error handling and is therefore a low-impact edit.",68710
23,src/RF011 - Gerenciar Competencias Portfolio.claret,exp01_gti-competencias_v0.1,exp01_gti-competencias_v1.0,"-    step 4 system ""apresenta o formulario para cadastro e alteracao de competecias (portfolio)""	","+    step 4 system ""apresenta o formulario para cadastro e alteracao de Competencias (Portfolio)""	",LOW,0,32,3,"{'TC14', 'TC9', 'TC35', 'TC11', 'TC19', 'TC16', 'TC5', 'TC12', 'TC23', 'TC15', 'TC8', 'TC30', 'TC18', 'TC25', 'TC7', 'TC31', 'TC21', 'TC10', 'TC34', 'TC6', 'TC29', 'TC24', 'TC22', 'TC26', 'TC17', 'TC20', 'TC13', 'TC28', 'TC4', 'TC32', 'TC27', 'TC33'}",35,LOW,The change is a low-impact syntactic edit as it only introduces an alternative flow (af) reference without modifying the system's behavior.,66377
24,src/RF011 - Gerenciar Competencias Portfolio.claret,exp01_gti-competencias_v0.1,exp01_gti-competencias_v1.0,"-  alternative 1 ""Editar competecias (portfolio) Existente"" {	-    step 1 lider ""seleciona um competecias (portfolio) da listagem""	-    step 2 system ""destaca o competecias (portfolio) selecionado na listagem""	-    step 3 lider ""clica na opcao 'Editar' para modificar o competecias (portfolio) selecionado"" bs 4	","+  alternative 1 ""Editar Competencias (Portfolio) Existente"" {	+    step 1 lider ""seleciona um Competencias (Portfolio) da listagem""	+    step 2 system ""destaca o Competencias (Portfolio) selecionado na listagem""	+    step 3 lider ""clica na opcao 'Editar' para modificar o Competencias (Portfolio) selecionado"" bs 4	",LOW,0,16,19,"{'TC11', 'TC19', 'TC17', 'TC16', 'TC14', 'TC9', 'TC13', 'TC5', 'TC12', 'TC4', 'TC15', 'TC10', 'TC8', 'TC6', 'TC18', 'TC7'}",35,LOW,"The change adds an alternative flow to the use case, which does not alter the overall system behavior (semantic edit) and introduces new steps without changing existing requirements or business model entities.",55177
25,src/RF011 - Gerenciar Competencias Portfolio.claret,exp01_gti-competencias_v0.1,exp01_gti-competencias_v1.0,"-  alternative 2 ""Confirmar Exclusao do competecias (portfolio)"" {	-  	step 1 lider ""seleciona um competecias (portfolio) da listagem""	-    step 2 system ""destaca o competecias (portfolio) selecionado na listagem""	-    step 3 lider ""clica na opcao 'Excluir' para excluir o competecias (portfolio) selecionado""	","+  alternative 2 ""Confirmar Exclusao do Competencias (Portfolio)"" {	+  	step 1 lider ""seleciona um Competencias (Portfolio) da listagem""	+    step 2 system ""destaca o Competencias (Portfolio) selecionado na listagem""	+    step 3 lider ""clica na opcao 'Excluir' para excluir o Competencias (Portfolio) selecionado""	",LOW,0,2,33,"{'TC3', 'TC2'}",35,LOW,The change is syntactic; it modifies the system response text without altering its behavior or introducing new requirements.,40285
26,src/RF011 - Gerenciar Competencias Portfolio.claret,exp01_gti-competencias_v0.1,exp01_gti-competencias_v1.0,"-    step 6 system ""exibe a listagem dos competencias (portfolio) sem o competecias (portfolio) excluido""	","+    step 6 system ""exibe a listagem dos Competencias (Portfolio) sem o Competencias (Portfolio) excluido"" ef[3]	",HIGH,0,1,34,{'TC3'},35,LOW,"The change is purely textual, providing more detail about the system's actions without altering its behavior.",41203
27,src/RF011 - Gerenciar Competencias Portfolio.claret,exp01_gti-competencias_v0.1,exp01_gti-competencias_v1.0,"-  alternative 3 ""Negar Exclusao do competecias (portfolio)"" {	-  	step 1 lider ""seleciona um competecias (portfolio) da listagem""	-    step 2 system ""destaca o competecias (portfolio) selecionado na listagem""	-    step 3 lider ""clica na opcao 'Excluir' para excluir o competecias (portfolio) selecionado""	","+  alternative 3 ""Negar Exclusao do Competencias (Portfolio)"" {	+  	step 1 lider ""seleciona um Competencias (Portfolio) da listagem""	+    step 2 system ""destaca o Competencias (Portfolio) selecionado na listagem""	+    step 3 lider ""clica na opcao 'Excluir' para excluir o Competencias (Portfolio) selecionado""	",LOW,0,2,33,"{'TC3', 'TC2'}",35,LOW,"The change is purely textual, updating the system's output message without altering its behavior.",36473
28,src/RF011 - Gerenciar Competencias Portfolio.claret,exp01_gti-competencias_v0.1,exp01_gti-competencias_v1.0,"-    step 6 system ""exibe a listagem dos competencias (portfolio) com o competecias (portfolio) excluido""	","+    step 6 system ""exibe a listagem dos Competencias (Portfolio) com o Competencias (Portfolio) excluido""	",LOW,0,1,34,{'TC2'},35,LOW,"The change is only textual, adding more detail to the system's action without altering its behavior.",45293
29,src/RF011 - Gerenciar Competencias Portfolio.claret,exp01_gti-competencias_v0.1,exp01_gti-competencias_v1.0,"-  	step 1 usuarioNA ""acessa a funcionalidade de gestao de competencias (portfolio) a partir do menu inicial""	-  	step 2 system ""exibe a listagem dos competencias (portfolio) cadastrados apenas para visualizacao com a opcao 'Ajuda'""	","+  	step 1 usuarioNA ""acessa a funcionalidade de gestao de Competencias (Portfolio) a partir do menu inicial""	+  	step 2 system ""exibe a listagem dos Competencias (Portfolio) cadastrados apenas para visualizacao com a opcao 'Ajuda'""	",LOW,0,1,34,{'TC1'},35,LOW,"The change is purely textual and does not introduce new functionality, requirements, or alter the system's behavior. It simply adds more detail to an existing step.",51623
30,src/RF011 - Gerenciar Competencias Portfolio.claret,exp01_gti-competencias_v0.1,exp01_gti-competencias_v1.0,"-  postCondition ""A gestao de competencias (portfolio) e realizada com sucesso.""	","+  postCondition ""A gestao de Competencias (Portfolio) e realizada com sucesso.""	",LOW,0,8,27,"{'TC11', 'TC19', 'TC35', 'TC23', 'TC15', 'TC27', 'TC7', 'TC31'}",35,LOW,The change is merely textual (update): formatting. The meaning of the precondition remains unchanged.,46052
