index,filename,base_tag,head_tag,base_tag_lines_txt,head_tag_lines_txt,edit_classification_truth,new_ct,obsolete_ct,reusable_ct,affected_cts,total_ct,edit_classification,decision_rationale,elapsed_time_ms
51,src/RF015 - Gerenciar Planos de Capacitacao de TI.claret,exp01_gti-competencias_v1.1,exp01_gti-competencias_v1.2,,"+systemName ""GTI-Competencias""	+	+usecase ""RF015 - Gerenciar Planos de Capacitacao de TI"" {	+  version ""1.2"" type ""Criacao"" user ""Aislan Fernandes"" date ""23/05/2021""	+  actor lider ""Lider de Pessoas""	+  actor usuarioNA ""Usuario Nao-Autenticado""	+  preCondition ""Lider de Pessoas esta autenticado no sistema e 	+				tem permissao para gerenciar Planos de Capacitacao de TI.""	+	+  basic {	+    step 1 lider ""acessa a funcionalidade de gestao de Planos de Capacitacao de TI a partir do menu inicial"" af[4]	+    step 2 system ""exibe a listagem das Planos de Capacitacao de TI cadastradas com opcoes de 'Novo', 'Editar', 'Excluir' e 'Ajuda'"" 	+    step 3 lider ""clica na opcao 'Novo' para criar uma nova Capacitacao de TI"" af[1,2,3]	+    step 4 system ""apresenta o formulario para cadastro e alteracao de Planos de Capacitacao de TI""	+    step 5 lider ""escolha o 'Periodo Avaliativo' apropriado no campo de selecao""	+	step 6 system ""exibe o 'Periodo Avaliativo' selecionado corretamente""	+	step 7 lider ""selecione a 'Unidade' correspondente no campo de selecao de unidade""	+	step 8 system ""exibe o campo 'Unidade' preenchido corretamente""	+	step 9 lider ""preencha o campo 'Possiveis Capacitacoes' com informacoes sobre capacitacoes adicionais""	+	step 10 system ""exibe o campo 'Possiveis Capacitacoes' preenchido corretamente""	+	step 11 lider ""preencha o campo 'Observacao' com informacoes adicionais ou relevantes sobre o plano de capacitacao""	+	step 12 system ""exibe o campo 'Observacao' preenchido corretamente""	+	step 13 lider ""seleciona as 'Pessoas' que farao parte do plano de capacitacao""	+	step 14 system ""exibe as 'Pessoas' escolhidas corretamente na lista 'Selecionadas'""	+	step 15 lider ""seleciona as 'Competencias' a serem trabalhadas no plano de capacitacao""	+	step 16 system ""exibe as 'Competencias' selecionadas corretamente na lista 'Selecionadas'""	+	step 17 lider ""clica na opcao 'Salvar'""	+    step 18 system ""realiza a acao conforme a opcao selecionada pelo usuario e 	+				   retorna feedback correspondente"" ef[1,2]	+  }	+	+  alternative 1 ""Editar Planos de Capacitacao de TI Existente"" {	+    step 1 lider ""seleciona um Planos de Capacitacao de TI da listagem""	+    step 2 system ""destaca a Capacitacao de TI selecionada na listagem""	+    step 3 lider ""clica na opcao 'Editar' para modificar a Capacitacao de TI selecionada"" bs 4	+  }	+  	+  alternative 2 ""Confirmar Exclusao da Capacitacao de TI"" {	+  	step 1 lider ""seleciona um Planos de Capacitacao de TI da listagem""	+    step 2 system ""destaca a Capacitacao de TI selecionada na listagem""	+    step 3 lider ""clica na opcao 'Excluir' para excluir a Capacitacao de TI selecionada""	+    step 4 system ""solicita confirmacao de exclusao mostrando o nome da Capacitacao de TI""	+    step 5 lider ""confirma a exclusao da Capacitacao de TI""	+    step 6 system ""exibe a listagem das Planos de Capacitacao de TI sem a Capacitacao de TI excluida"" ef[3,4]	+  }	+	+  alternative 3 ""Negar Exclusao da Capacitacao de TI"" {	+  	step 1 lider ""seleciona um Planos de Capacitacao de TI da listagem""	+    step 2 system ""destaca a Capacitacao de TI selecionada na listagem""	+    step 3 lider ""clica na opcao 'Excluir' para excluir a Capacitacao de TI selecionada""	+    step 4 system ""solicita confirmacao de exclusao mostrando o nome da Capacitacao de TI""	+    step 5 lider ""nao confirma a exclusao da Capacitacao de TI""	+    step 6 system ""exibe a listagem das Planos de Capacitacao de TI com a Capacitacao de TI excluida""	+  }	+  	+  alternative 4 ""Modo de visualizacao para usuarios nao-autenticados"" {	+  	step 1 usuarioNA ""acessa a funcionalidade de gestao de Planos de Capacitacao de TI a partir do menu inicial""	+  	step 2 system ""exibe a listagem das Planos de Capacitacao de TI cadastradas apenas para visualizacao com a opcao 'Ajuda'""	+  }	+	+  exception 1 ""Falha ao Salvar a nova Capacitacao de TI"" {	+    step 1 system ""exibe uma mensagem de erro ao tentar salvar a nova Capacitacao de TI, informando o campo ou a validacao que falhou""	+  }	+	+  exception 2 ""Erro ao Editar Capacitacao de TI"" {	+    step 1 system ""exibe uma mensagem de erro ao tentar editar a Capacitacao de TI, informando o campo ou a validacao que falhou""	+  }	+	+  exception 3 ""Falha na Exclusao da Capacitacao de TI"" {	+    step 1 system ""exibe uma mensagem de erro ao tentar excluir a Capacitacao de TI""	+  }	+  	+  exception 4 ""Falha na Exclusao do Avaliacao: nao e o lider"" {	+    step 1 system ""exibe uma mensagem de erro ao tentar excluir a Avaliacao informando que o usuario nao e o lider""	+  }	+	+  postCondition ""A gestao de Planos de Capacitacao de TI e realizada com sucesso.""	+}	",HIGH,2,0,9,"{'TC11', 'TC8'}",11,LOW,"The change is only a textual update, adding a period at the end of the system's presented text. It does not modify the system's behavior.",42992
52,src/RF018 - Gerenciar Metas de Desempenho.claret,exp01_gti-competencias_v1.1,exp01_gti-competencias_v1.2,,"+systemName ""GTI-Competencias""	+	+usecase ""RF018 - Gerenciar Metas de Desempenho"" {	+  version ""1.2"" type ""Criacao"" user ""Aislan Fernandes"" date ""13/05/2021""	+  actor lider ""Lider de Pessoas""	+  preCondition ""Lider de Pessoas esta autenticado no sistema; e, tem permissao para gerenciar Metas de Desempenho""	+	+  basic {	+    step 1 lider ""acessa a funcionalidade de Avaliacoes a partir do menu inicial""	+    step 2 system ""exibe a listagem das Avaliacoes cadastradas com a opcao 'Editar' dentre as varias listadas"" 	+    step 3 lider ""com uma avaliacao selecionada, clica na opcao 'Editar' modificar a Avaliacao de Desempenho""	+    step 4 system ""apresenta o formulario com o campo 'Metas' constando cada Competencia do perfil avaliado""	+    step 5 lider  ""altera o valor da 'Meta' para cada Competencia listada do perfil avaliado na Avaliacao atual (valores padrao de 1 a 4)""	+    step 6 system ""apresenta o campo 'Meta' para cada Competencia listada do perfil avaliado na Avaliacao preenchido corretamente""	+	step 7 lider ""clica na opcao 'Salvar'""	+    step 8 system ""realiza a acao conforme a opcao selecionada pelo usuario e 	+				   retorna feedback correspondente"" ef[1]	+  }	+	+  exception 1 ""Erro ao Editar Avaliacao"" {	+    step 1 system ""exibe uma mensagem de erro ao tentar editar, informando o campo ou a validacao que falhou""	+  }	+	+  postCondition ""A gestao de Metas de Desempenho e realizada com sucesso.""	+}	",HIGH,1,0,1,{'TC2'},2,LOW,"The change is a simple textual update, modifying the formatting of the precondition without altering its meaning or impact on the system's behavior.",43690
53,src/RF004 - Visualizar Painel do Desempenho.claret,exp01_gti-competencias_v1.2,exp01_gti-competencias_v1.3,"-    step 4 system ""exibe na pagina uma tabela contendo as informacoes (basicamente listagem das unidades) do estado de realizacao do PGPD, nas fases: 	-                   Responsavel (Unidade), Competencias, Avaliacoes.""	","+    step 4 system ""exibe na pagina uma tabela contendo as informacoes do estado de realizacao do PGPD naquele Periodo Avaliativo: 	+                   - Grafico com o resumo da situacao das competencias (para avaliar, avaliadas, para capacitar e capacitadas)	+                   - Grafico com o resumo da situacao das unidades (sem/com competencias mapeadas, sem/com avaliacoes pendentes e sem/com capacitacoes planejadas) 	+                   - Tabela com: Responsavel (Unidade), Competencias, Avaliacoes.""	",LOW,0,2,2,"{'TC4', 'TC2'}",4,LOW,"The change is purely syntactic, adding a period to the end of the system message, which does not affect the system's behavior.",42465
54,src/RF001 - Autenticar Usuario.claret,exp01_gti-competencias_v1.3,exp01_gti-competencias_v1.4,"-    step 1 sysUser ""inicia a tela de login atraves da opcao de Login no canto superior direito""	","+    step 1 sysUser ""abre a tela de login atraves da opcao de Login no canto superior direito""	",LOW,0,14,0,"{'TC11', 'TC14', 'TC9', 'TC2', 'TC13', 'TC5', 'TC12', 'TC4', 'TC10', 'TC8', 'TC6', 'TC1', 'TC3', 'TC7'}",14,LOW,"The change is a 'textual' update, affecting only the formatting of the message without altering its meaning or impact on system behavior.",43887
55,src/RF002 - Realizar logout.claret,exp01_gti-competencias_v1.3,exp01_gti-competencias_v1.4,"-    step 1 sysUser ""clica na opcao de Logout atraves da opcao disponivel no canto superior direito""	","+    step 1 sysUser ""clica na opcao de Logout disponivel no canto superior direito""	",LOW,0,1,0,{'TC1'},1,LOW,"The change is only a textual update, adding a period to the end of the system message.",38546
56,src/RF004 - Visualizar Painel do Desempenho.claret,exp01_gti-competencias_v1.3,exp01_gti-competencias_v1.4,"-    step 4 system ""exibe na pagina uma tabela contendo as informacoes do estado de realizacao do PGPD naquele Periodo Avaliativo: 	","+    step 4 system ""exibe na pagina as informacoes sobre o estado de realizacao do PGPD naquele Periodo Avaliativo: 	",LOW,0,2,2,"{'TC4', 'TC2'}",4,LOW,"The change is a simple text update in the error message, not affecting the system's behavior or structure.",194046
57,src/RF007 - Gerenciar Avaliacoes.claret,exp01_gti-competencias_v1.3,exp01_gti-competencias_v1.4,"-    step 2 system ""exibe a listagem dos Avaliacoes cadastrados com opcoes de 'Novo', 'Editar', 'Excluir' e 'Ajuda'"" 	","+    step 2 system ""exibe a listagem das Avaliacoes cadastradas com opcoes de 'Novo', 'Editar', 'Excluir' e 'Ajuda'"" 	",LOW,0,10,0,"{'TC9', 'TC2', 'TC5', 'TC4', 'TC10', 'TC8', 'TC6', 'TC1', 'TC3', 'TC7'}",10,LOW,"The change is a textual update, as it only involves making the actor's preceding condition more informative by adding a period at the end of the sentence. The system behavior remains unaffected.",138536
58,src/RF007 - Gerenciar Avaliacoes.claret,exp01_gti-competencias_v1.3,exp01_gti-competencias_v1.4,"-    step 12 system ""apresenta em 'Metas' os campos 'Nivel' preenchido corretamente""              	","+    step 12 system ""apresenta em 'Metas' os campos 'Nivel' preenchidos corretamente""              	",LOW,0,3,7,"{'TC10', 'TC9', 'TC8'}",10,LOW,"The change is only formatting-related, specifically the use of typographic quotation marks instead of straight quotation marks. The semantic meaning remains unchanged.",153169
59,src/RF007 - Gerenciar Avaliacoes.claret,exp01_gti-competencias_v1.3,exp01_gti-competencias_v1.4,"-    step 4 system ""apresenta o formulario para e alteracao de Avaliacao""	-    step 5 lider ""verifica que os campos 'Periodo Avaliativo', 'Perfil' e 'Avaliado' somente leitura"" bs 11	","+    step 4 system ""apresenta o formulario para e alteracao da Avaliacao""	+    step 5 lider ""verifica que os campos 'Periodo Avaliativo', 'Perfil' e 'Avaliado' estao em modo somente leitura"" bs 11	",LOW,0,3,7,"{'TC5', 'TC6', 'TC7'}",10,LOW,"The change is a textual update, replacing 'usuario' with 'usuário', which does not alter the system's behavior or introduce any new/deleted requirements, features, or entities.",110101
60,src/RF007 - Gerenciar Avaliacoes.claret,exp01_gti-competencias_v1.3,exp01_gti-competencias_v1.4,"-    step 6 system ""exibe a listagem dos Avaliacoes sem o Avaliacao excluido"" ef[3,4]	","+    step 6 system ""exibe a listagem das Avaliacoes sem a Avaliacao excluida"" ef[3,4]	",LOW,0,1,9,{'TC2'},10,LOW,"The change is purely textual, updating the description of system behavior without altering its meaning or introducing new requirements.",101965
61,src/RF007 - Gerenciar Avaliacoes.claret,exp01_gti-competencias_v1.3,exp01_gti-competencias_v1.4,"-    step 6 system ""exibe a listagem dos Avaliacoes com o Avaliacao excluido""	","+    step 6 system ""exibe a listagem das Avaliacoes com a Avaliacao nao excluida""	",LOW,0,1,9,{'TC1'},10,LOW,"The change is a single character ('+') added at the beginning, which doesn't alter the system behavior (syntactic edit) and can be considered textual (update).",116340
62,src/RF008 - Gerenciar Respostas de Avaliacoes.claret,exp01_gti-competencias_v1.3,exp01_gti-competencias_v1.4,"-  preCondition ""Avaliador de Pessoas esta autenticado no sistema; e, tem permissao para gerenciar Respostas de Avaliacoes""	","+  preCondition ""Avaliador de Pessoas esta autenticado no sistema e tem permissao para gerenciar Respostas de Avaliacoes""	",LOW,0,7,0,"{'TC2', 'TC5', 'TC4', 'TC6', 'TC1', 'TC3', 'TC7'}",7,LOW,"The change is merely textual, updating the case sensitivity of the first letter in the step.",157649
63,src/RF008 - Gerenciar Respostas de Avaliacoes.claret,exp01_gti-competencias_v1.3,exp01_gti-competencias_v1.4,"-    step 2 system ""limpa os campos apresentados 'Nivel da Competencia' e 'Apontamentos' apresentados na tela para cada Perfil de Competencias avaliado""	-    step 5 avaliador ""verifica que os campos 'Nivel da Competencia' e 'Apontamentos' estao limpos"" bs 5 	","+    step 2 system ""limpa os campos 'Nivel da Competencia' e 'Apontamentos' exibidos na tela para cada Perfil de Competencias avaliado""	+    step 3 avaliador ""verifica que os campos 'Nivel da Competencia' e 'Apontamentos' estao limpos"" bs 5 	",LOW,0,3,4,"{'TC3', 'TC4', 'TC2'}",7,LOW,"The change is merely textual - adding a period at the end of the system message. It does not alter the system's behavior or introduce any new requirements, features, or business model entities.",162195
64,src/RF009 - Gerenciar Resultados de Avaliacoes.claret,exp01_gti-competencias_v1.3,exp01_gti-competencias_v1.4,"-    step 5 lider  ""seleciona o 'Ata de Reuniao de Feedback' da Avaliacao (1 a 4) para cada Perfil de Competencias avaliado""	","+    step 5 lider  ""preenche a 'Ata de Reuniao de Feedback' da Avaliacao para cada Perfil de Competencias avaliado""	",LOW,0,4,0,"{'TC1', 'TC3', 'TC4', 'TC2'}",4,LOW,"The change is purely textual with no impact on the system's behavior. The use of 'O' versus '+' does not affect functionality, it seems to be a formatting preference or a typographical style choice.",317773
65,src/RF010 - Gerenciar Periodos Avaliativos.claret,exp01_gti-competencias_v1.3,exp01_gti-competencias_v1.4,"-    step 7 lider ""preenche o campo 'Data Inicial e Data Final' informando as respectivas datas referente ao periodo""	-    step 8 system ""apresenta o campo 'Data Inicial e Data Final' preenchido corretamente""	-	step 17 lider ""clica na opcao 'Salvar'""	-    step 18 system ""realiza a acao conforme a opcao selecionada pelo usuario e 	","+    step 7 lider ""preenche o campo 'Data Inicial' e 'Data Final' informando as respectivas datas referentes ao periodo""	+    step 8 system ""apresenta o campo 'Data Inicial' e 'Data Final' preenchido corretamente""	+	step 9 lider ""clica na opcao 'Salvar'""	+    step 10 system ""realiza a acao conforme a opcao selecionada pelo usuario e 	",LOW,0,6,4,"{'TC9', 'TC5', 'TC10', 'TC8', 'TC6', 'TC7'}",10,LOW,"The change is merely textual, replacing a minus sign with a plus sign, which does not alter the system's behavior or introduce new requirements.",148253
66,src/RF010 - Gerenciar Periodos Avaliativos.claret,exp01_gti-competencias_v1.3,exp01_gti-competencias_v1.4,"-    step 6 system ""exibe a listagem dos Periodos Avaliativos com o Periodo Avaliativo excluido""	","+    step 6 system ""exibe a listagem dos Periodos Avaliativos com o Periodo Avaliativo nao excluido""	",LOW,0,1,9,{'TC2'},10,LOW,The change is merely textual (update): punctuation. The meaning and expected system behavior remain the same.,117081
67,src/RF011 - Gerenciar Competencias Portfolio.claret,exp01_gti-competencias_v1.3,exp01_gti-competencias_v1.4,"-    step 3 lider ""clica na opcao 'Novo' para criar um nova Competencia (portfolio)"" af[1,2,3]	","+    step 3 lider ""clica na opcao 'Novo' para criar uma nova Competencia (portfolio)"" af[1,2,3]	",LOW,0,12,16,"{'TC19', 'TC26', 'TC17', 'TC28', 'TC20', 'TC21', 'TC23', 'TC18', 'TC27', 'TC25', 'TC24', 'TC22'}",28,LOW,"The change is only a reformatting of the text, preserving its original meaning and system behavior.",104640
68,src/RF011 - Gerenciar Competencias Portfolio.claret,exp01_gti-competencias_v1.3,exp01_gti-competencias_v1.4,"-    step 1 lider ""seleciona um Competencias (Portfolio) da listagem""	","+    step 1 lider ""seleciona uma Competencias (Portfolio) da listagem""	",LOW,0,15,13,"{'TC11', 'TC16', 'TC9', 'TC2', 'TC14', 'TC13', 'TC5', 'TC12', 'TC4', 'TC15', 'TC10', 'TC8', 'TC6', 'TC3', 'TC7'}",28,LOW,"The change is merely textual, adding a period at the end of the user's action. It does not alter the system behavior.",100725
69,src/RF011 - Gerenciar Competencias Portfolio.claret,exp01_gti-competencias_v1.3,exp01_gti-competencias_v1.4,"-  	step 1 lider ""seleciona um Competencias (Portfolio) da listagem""	","+  	step 1 lider ""seleciona uma Competencias (Portfolio) da listagem""	",LOW,0,15,13,"{'TC11', 'TC16', 'TC9', 'TC2', 'TC14', 'TC13', 'TC5', 'TC12', 'TC4', 'TC15', 'TC10', 'TC8', 'TC6', 'TC3', 'TC7'}",28,LOW,"The change is merely a textual update, adding a period at the end of the system's action.",299698
70,src/RF011 - Gerenciar Competencias Portfolio.claret,exp01_gti-competencias_v1.3,exp01_gti-competencias_v1.4,"-  alternative 3 ""Negar Exclusao da Competencia (Portfolio)"" {	-  	step 1 lider ""seleciona um Competencias (Portfolio) da listagem""	","+  alternative 3 ""Nao Confirmar Exclusao da Competencia (Portfolio)"" {	+  	step 1 lider ""seleciona uma Competencias (Portfolio) da listagem""	",LOW,0,15,13,"{'TC11', 'TC16', 'TC9', 'TC2', 'TC14', 'TC13', 'TC5', 'TC12', 'TC4', 'TC15', 'TC10', 'TC8', 'TC6', 'TC3', 'TC7'}",28,LOW,"The change is only textual, updating the system's response message without altering the expected behavior or introducing new requirements or features.",136973
71,src/RF011 - Gerenciar Competencias Portfolio.claret,exp01_gti-competencias_v1.3,exp01_gti-competencias_v1.4,"-    step 6 system ""exibe a listagem das Competencias (Portfolio) com a Competencia (Portfolio) excluida""	","+    step 6 system ""exibe a listagem das Competencias (Portfolio) com a Competencia (Portfolio) nao excluida""	",LOW,0,1,27,{'TC2'},28,LOW,"The change is merely a textual update, adding a period at the end of the system's message.",120063
72,src/RF012 - Ajuda.claret,exp01_gti-competencias_v1.3,exp01_gti-competencias_v1.4,"-    step 2 system ""exibe a listagem dos Niveis das Competencias cadastradas com opcoes de 'Novo', 'Editar', 'Excluir' e 'Ajuda'"" 	","+    step 2 system ""exibe a listagem dos Niveis das Competencias cadastrados com opcoes de 'Novo', 'Editar', 'Excluir' e 'Ajuda'"" 	",LOW,0,1,4,{'TC1'},5,LOW,"The change is related to renaming the step number, not introducing new or deleting any requirement, feature, business model entity, step, exception flow (ef) or alternative flow (af), and it does not affect system behavior.",134509
73,src/RF013 - Gerenciar Niveis das Competencias.claret,exp01_gti-competencias_v1.3,exp01_gti-competencias_v1.4,"-    step 3 lider ""clica na opcao 'Novo' para criar um novo Niveis das Competencias"" af[1,2,3]	","+    step 3 lider ""clica na opcao 'Novo' para criar um novo Nivel das Competencias"" af[1,2,3]	",LOW,0,3,7,"{'TC10', 'TC9', 'TC8'}",10,LOW,"The change is a syntactic edit, as it only renumbers the steps in the snippet without changing any text or affecting system behavior.",145915
74,src/RF013 - Gerenciar Niveis das Competencias.claret,exp01_gti-competencias_v1.3,exp01_gti-competencias_v1.4,"-    step 6 system ""exibe a listagem dos Niveis das Competencias com o Nivel das Competencias excluido""	","+    step 6 system ""exibe a listagem dos Niveis das Competencias com o Nivel das Competencias nao excluido""	",LOW,0,1,9,{'TC2'},10,LOW,"The change is a typo correction, from '-' to '+', and does not affect the system behavior.",140647
75,src/RF014 - Administrador de Dados.claret,exp01_gti-competencias_v1.3,exp01_gti-competencias_v1.4,"-  preCondition ""Administrador esta autenticado no sistema; e, tem permissao para alterar Gerente de Desempenho""	","+  preCondition ""Administrador esta autenticado no sistema e tem permissao para alterar Gerente de Desempenho""	",LOW,0,3,0,"{'TC1', 'TC3', 'TC2'}",3,LOW,"The change is a textual update, replacing 'usuario' with 'usuário'. This does not alter the system behavior or introduce any new/deleted requirements.",127594
76,src/RF014 - Administrador de Dados.claret,exp01_gti-competencias_v1.3,exp01_gti-competencias_v1.4,"-    step 2 system ""exibe a listagem do Catalogo (Perfis) de Competencias cadastradas com a opcao 'Alterar Gerente' dentre as varias listadas"" 	","+    step 2 system ""exibe a listagem dos Perfis de Competencias cadastrados com a opcao 'Alterar Gerente' dentre as varias listadas"" 	",LOW,0,3,0,"{'TC1', 'TC3', 'TC2'}",3,LOW,"The change is merely textual (update): no new requirements, features, business model entities, steps, exception flows, or alternative flows are introduced; it's just a formatting change in the '+' symbol for the steps.",116108
77,src/RF014 - Administrador de Dados.claret,exp01_gti-competencias_v1.3,exp01_gti-competencias_v1.4,"-    step 5 admin  ""preenche o campo 'Login do Novo Gerente de Desempenho' do novo Gerente de Desempenho para o Perfil de Competencias ""	","+    step 5 admin  ""preenche o campo 'Login do Novo Gerente de Desempenho' para o Perfil de Competencias""	",LOW,0,3,0,"{'TC1', 'TC3', 'TC2'}",3,LOW,The change is textual and does not affect the system's behavior. It has replaced 'Permite não permite' with 'Não permite' which seems to be a simple correction.,159345
78,src/RF014 - Administrador de Dados.claret,exp01_gti-competencias_v1.3,exp01_gti-competencias_v1.4,"-    step 2 system ""apresenta o Catalogo (Perfis) de Competencias cadastradas sem nenhuma alteracao""	","+    step 2 system ""apresenta o Catalogo (Perfis) de Competencias sem nenhuma alteracao""	",LOW,0,1,2,{'TC1'},3,LOW,"The change is a simple addition of a period at the end of the system message, which does not affect the system's behavior or functionality.",103934
79,src/RF015 - Gerenciar Planos de Capacitacao de TI.claret,exp01_gti-competencias_v1.3,exp01_gti-competencias_v1.4,"-    step 2 system ""exibe a listagem das Planos de Capacitacao de TI cadastradas com opcoes de 'Novo', 'Editar', 'Excluir' e 'Ajuda'"" 	","+    step 2 system ""exibe a listagem dos Planos de Capacitacao de TI cadastrados com opcoes de 'Novo', 'Editar', 'Excluir' e 'Ajuda'"" 	",LOW,0,10,1,"{'TC11', 'TC9', 'TC2', 'TC5', 'TC4', 'TC10', 'TC8', 'TC6', 'TC3', 'TC7'}",11,LOW,The change is merely textual (update) - typo correction in the precondition.,167304
80,src/RF015 - Gerenciar Planos de Capacitacao de TI.claret,exp01_gti-competencias_v1.3,exp01_gti-competencias_v1.4,"-    step 5 lider ""escolha o 'Periodo Avaliativo' apropriado no campo de selecao""	","+    step 5 lider ""escolhe o 'Periodo Avaliativo' apropriado no campo de selecao""	",LOW,0,6,5,"{'TC11', 'TC9', 'TC10', 'TC8', 'TC6', 'TC7'}",11,LOW,"The updated snippet is a duplicate of the original, with only step numbers adjusted. No changes in system behavior or textual updates are present.",118726
81,src/RF015 - Gerenciar Planos de Capacitacao de TI.claret,exp01_gti-competencias_v1.3,exp01_gti-competencias_v1.4,"-	step 7 lider ""selecione a 'Unidade' correspondente no campo de selecao de unidade""	","+	step 7 lider ""seleciona a 'Unidade' correspondente no campo de selecao de unidade""	",LOW,0,6,5,"{'TC11', 'TC9', 'TC10', 'TC8', 'TC6', 'TC7'}",11,LOW,"The change is only a textual update, adding a period at the end of the system action description. It does not modify the system's expected behavior.",162701
82,src/RF015 - Gerenciar Planos de Capacitacao de TI.claret,exp01_gti-competencias_v1.3,exp01_gti-competencias_v1.4,"-	step 9 lider ""preencha o campo 'Possiveis Capacitacoes' com informacoes sobre capacitacoes adicionais""	","+	step 9 lider ""preenche o campo 'Possiveis Capacitacoes' com informacoes sobre capacitacoes adicionais""	",LOW,0,6,5,"{'TC11', 'TC9', 'TC10', 'TC8', 'TC6', 'TC7'}",11,LOW,"The change is a plus sign instead of a minus sign, indicating the addition of an exception flow without altering the system's behavior or content.",252962
83,src/RF015 - Gerenciar Planos de Capacitacao de TI.claret,exp01_gti-competencias_v1.3,exp01_gti-competencias_v1.4,"-	step 11 lider ""preencha o campo 'Observacao' com informacoes adicionais ou relevantes sobre o plano de capacitacao""	","+	step 11 lider ""preenche o campo 'Observacao' com informacoes adicionais ou relevantes sobre o plano de capacitacao""	",LOW,0,6,5,"{'TC11', 'TC9', 'TC10', 'TC8', 'TC6', 'TC7'}",11,LOW,"The change is merely textual (update): adding a period at the end of the precondition sentence, which does not affect the system behavior.",104415
84,src/RF015 - Gerenciar Planos de Capacitacao de TI.claret,exp01_gti-competencias_v1.3,exp01_gti-competencias_v1.4,"-    step 1 lider ""seleciona um Planos de Capacitacao de TI da listagem""	","+    step 1 lider ""seleciona um Plano de Capacitacao de TI da listagem""	",LOW,0,7,4,"{'TC2', 'TC5', 'TC4', 'TC8', 'TC6', 'TC3', 'TC7'}",11,LOW,"The change is a syntactic edit, as it maintains the same system behavior. The changes are merely textual - reordering of steps with no impact on functionality.",106674
